Doi,Title,Year,Type,Url,Authors
10.1007/978-3-030-71903-6_37,Towards an Innovative Model in Wearable Expert System for Skiing,2021,book-chapter,https://doi.org/10.1007/978-3-030-71903-6_37,"Elson Kurian, Sherwin Varghese, Stefano Fiorini"
10.1002/mp.17089,Deep learning‐based optimization of field geometry for total marrow irradiation delivered with volumetric modulated arc therapy,2024,journal-article,https://doi.org/10.1002/mp.17089,"Nicola Lambri, Giorgio Longari, Daniele Loiacono, Ricardo Coimbra Brioso, Leonardo Crespi, Carmela Galdieri, Francesca Lobefalo, Giacomo Reggiori, Roberto Rusconi, Stefano Tomatis, Luisa Bellu, Stefania Bramanti, Elena Clerici, Chiara De Philippis, Damiano Dei, Pierina Navarria, Carmelo Carlo‐Stella, Ciro Franzese, Marta Scorsetti, Pietro Mancosu"
10.1111/cgf.15136,Reconstructing Curves from Sparse Samples on Riemannian Manifolds,2024,journal-article,https://doi.org/10.1111/cgf.15136,"D. Marin, F. Maggioli, S. Melzi, S. Ohrhallinger, M. Wimmer"
10.48550/arXiv.2404.09661,Reconstructing Curves from Sparse Samples on Riemannian Manifolds,2024,other,,
10.1145/3610548.3618218,A Physically-inspired Approach to the Simulation of Plant Wilting,2023,conference-paper,https://doi.org/10.1145/3610548.3618218,"Filippo Maggioli, Jonathan Klein, Torsten Hädrich, Emanuele Rodolà, Wojtek Pałubicki, Sören Pirk, Dominik L. Michels"
10.1145/3610548.3618218,A Physically-inspired Approach to the Simulation of Plant Wilting,2023,conference-paper,,"Filippo Maggioli, Jonathan Klein, Torsten Hädrich, Emanuele Rodolà, Wojtek Pałubicki, Sören Pirk, Dominik L. Michels"
10.48550/arXiv.2311.06284,Efficient Generation of Multimodal Fluid Simulation Data,2023,other,,
10.48550/arXiv.2303.09871,Fluid Dynamics Network: Topology-Agnostic 4D Reconstruction via Fluid Dynamics Priors,2023,other,,
10.48550/arXiv.2305.09274,ReMatching: Low-Resolution Representations for Scalable Shape Correspondence,2023,other,,
10.1111/cgf.14697,MoMaS: Mold Manifold Simulation for real‐time procedural texturing,2022,journal-article,https://doi.org/10.1111/cgf.14697,"F. Maggioli, R. Marin, S. Melzi, E. Rodolà"
10.1111/cgf.14697,MoMaS: Mold Manifold Simulation for real-time procedural texturing,2022,journal-article,,"F. Maggioli, R. Marin, S. Melzi, E. Rodolà"
10.1111/cgf.14483,Learning Spectral Unions of Partial Deformable 3D Shapes,2022,book-chapter,,"Luca Moschella, Simone Melzi, Luca Cosmo, Filippo Maggioli, Or Litany, Maks Ovsjanikov, Leonidas Guibas, Emanuele Rodolà"
10.1111/cgf.14483,Learning Spectral Unions of Partial Deformable 3D Shapes,2022,journal-article,,"Luca Moschella, Simone Melzi, Luca Cosmo, Filippo Maggioli, Or Litany, Maks Ovsjanikov, Leonidas Guibas, Emanuele Rodolà"
10.1145/3532719.3543211,Newton's fractals on surfaces via bicomplex algebra,2022,conference-poster,,"Filippo Maggioli, Daniele Baieri, Simone Melzi, Emanuele Rodolà"
10.1145/3532719.3543211,Newton's Fractals on Surfaces via Bicomplex Algebra,2022,conference-paper,,"Filippo Maggioli, Daniele Baieri, Simone Melzi, Emanuele Rodolà"
10.1111/cgf.142645,Orthogonalized Fourier Polynomials for Signal Approximation and Transfer,2021,journal-article,https://doi.org/10.1111/cgf.142645,"F. Maggioli, S. Melzi, M. Ovsjanikov, M. M. Bronstein, E. Rodolà"
10.1111/cgf.142645,Orthogonalized Fourier Polynomials for Signal Approximation and Transfer,2021,journal-article,,"F. Maggioli, S. Melzi, M. Ovsjanikov, M. M. Bronstein, E. Rodolà"
10.1145/3472456.3473519,Efficiently Parallelizable Strassen-Based Multiplication of a Matrix by its Transpose,2021,conference-paper,,"Viviana Arrigoni, Filippo Maggioli, Annalisa Massini, Emanuele Rodolà"
10.48550/arxiv.2110.13042,Efficiently parallelizable Strassen-based multiplication of a matrix by its transpose,2021,other,,
10.48550/arXiv.2104.00514,Learning Spectral Unions of Partial Deformable 3D Shapes,2021,other,,
10.48550/arxiv.2106.02609,SBML2Modelica: Integrating biochemical models within open-standard simulation ecosystems,2021,other,,
10.1093/bioinformatics/btz860,SBML2Modelica: Integrating biochemical models within open-standard simulation ecosystems,2020,journal-article,,"F Maggioli, T Mancini, E Tronci"
11573/1356836,SBML2Modelica: Integrating biochemical models within open-standard simulation ecosystems,2019,journal-article,,
10.1007/978-3-031-26518-1_2,"AI, the Overall Picture",2023,book-chapter,https://doi.org/10.1007/978-3-031-26518-1_2,Luca Marconi
10.1007/978-3-031-26518-1_10,Opinion Dynamics,2023,book-chapter,https://doi.org/10.1007/978-3-031-26518-1_10,Luca Marconi
10.1007/978-3-030-77091-4_5,Explainable Attentional Neural Recommendations for Personalized Social Learning,2021,book,,"Luca Marconi, Ricardo Anibal Matamoros Aragon, Italo Zoppis, Sara Manzoni, Giancarlo Mauri, Francesco Epifania"
10.48550/ARXIV.2010.01534,Opinion dynamics and consensus formation in a Deffuant model with extremists and moderates,2020,preprint,https://doi.org/10.48550/ARXIV.2010.01534,
10.5220/0007749500850091,Optimized social explanation for educational platforms,2019,conference-paper,,"Italo Zoppis, Riccardo Dondi, Sara Manzoni, Giancarlo Mauri, Luca Marconi, Francesco Epifania"
10.28991/ESJ-2023-07-04-01,A Genetic Programming Based Heuristic to Simplify Rugged Landscapes Exploration,2023,journal-article,,"Gloria Pietropolli, Giuliamaria Menara, Mauro Castelli"
10.3390/app12104836,The Effect of Multi-Generational Selection in Geometric Semantic Genetic Programming,2022,journal-article,https://doi.org/10.3390/app12104836,"Mauro Castelli, Luca Manzoni, Luca Mariot, Giuliamaria Menara, Gloria Pietropolli"
10.3390/app12104836,The Effect of Multi-Generational Selection in Geometric Semantic Genetic Programming,2022,journal-article,,"Mauro Castelli, Luca Manzoni, Luca Mariot, Giuliamaria Menara, Gloria Pietropolli"
10.48550/arXiv.2206.03241,Combining Genetic Programming and Particle Swarm Optimization to Simplify Rugged Landscapes Exploration,2022,other,,
10.48550/arxiv.2205.02598,The Effect of Multi-Generational Selection in Geometric Semantic Genetic Programming,2022,other,,
10.1109/TFUZZ.2024.3362897,Similarity-Based Reasoning With Order-Sorted Feature Logic,2024,journal-article,https://doi.org/10.1109/TFUZZ.2024.3362897,"Gian Carlo Milanese, Gabriella Pasi"
10.1016/j.fss.2023.108800,Fuzzy order-sorted feature logic,2024,journal-article,https://doi.org/10.1016/j.fss.2023.108800,"Gian Carlo Milanese, Gabriella Pasi"
10.1109/fuzz45933.2021.9494474,Conjunctive Reasoning on Fuzzy Taxonomies with Order-Sorted Feature Logic,2021,conference-paper,https://doi.org/10.1109/fuzz45933.2021.9494474,"Gian Carlo Milanese, Gabriella Pasi"
10.1109/FUZZ45933.2021.9494474,Conjunctive Reasoning on Fuzzy Taxonomies with Order-Sorted Feature Logic,2021,conference-paper,https://doi.org/10.1109/FUZZ45933.2021.9494474,"Gian Carlo Milanese, Gabriella Pasi"
10.1007/978-3-662-59533-6_30,Closure Ordinals of the Two-Way Modal mu-Calculus,2019,conference-paper,https://doi.org/10.1007/978-3-662-59533-6_30,"Gian Carlo Milanese, Yde Venema"
10.1145/3643655.3643876,Towards Model-Driven Dashboard Generation for Systems-of-Systems,2024,conference-paper,https://doi.org/10.1145/3643655.3643876,"Maria Teresa Rossi, Alessandro Tundo, Leonardo Mariani"
10.1007/s10009-023-00697-z,A technology transfer journey to a model-driven access control system,2023,journal-article,,"Martina De Sanctis, Amleto Di Salle, Ludovico Iovino, Maria Teresa Rossi"
10.48550/arXiv.2309.02985,Supporting Early-Safety Analysis of IoT Systems by Exploiting Testing Techniques,2023,other,,
10.1007/s10270-021-00907-9,MIKADO: a smart city KPIs assessment modeling framework,2022,journal-article,https://doi.org/10.1007/s10270-021-00907-9,"Martina De Sanctis, Ludovico Iovino, Maria Teresa Rossi, Manuel Wimmer"
10.1007/s10270-021-00907-9,MIKADO: a smart city KPIs assessment modeling framework,2022,journal-article,,"Martina De Sanctis, Ludovico Iovino, Maria Teresa Rossi, Manuel Wimmer"
10.1109/MODELS-C53483.2021.00085,Leveraging Multi-Level Modeling for Multi-Domain Quality Assessment,2021,conference-paper,,"Maria Teresa Rossi, Martina Dal Molin, Ludovico Iovino, Martina De Sanctis, Manuel Wimmer"
10.1007/978-3-030-91431-8_43,Weaving Open Services with Runtime Models for Continuous Smart Cities KPIs Assessment,2021,book-chapter,https://doi.org/10.1007/978-3-030-91431-8_43,"Martina De Sanctis, Ludovico Iovino, Maria Teresa Rossi, Manuel Wimmer"
10.1007/978-3-030-91431-8_43,Weaving Open Services with Runtime Models for Continuous Smart Cities KPIs Assessment,2021,book,,"Martina De Sanctis, Ludovico Iovino, Maria Teresa Rossi, Manuel Wimmer"
10.1007/978-3-030-58923-3_8,A Flexible Architecture for Key Performance Indicators Assessment in Smart Cities,2020,book-chapter,https://doi.org/10.1007/978-3-030-58923-3_8,"Martina De Sanctis, Ludovico Iovino, Maria Teresa Rossi, Manuel Wimmer"
10.1007/978-3-030-58923-3_8,A flexible architecture for key performance indicators assessment in smart cities,2020,book,,"Martina De Sanctis, Ludovico Iovino, Maria Teresa Rossi, Manuel Wimmer"
10.1109/EuroSPW51379.2020.00087,Defensive Programming for Smart Home Cybersecurity,2020,conference-paper,,"Maria Teresa Rossi, Renan Greca, Ludovico Iovino, Giorgio Giacinto, Antonia Bertoli"
10.1109/MODELS-C.2019.00020,A multilevel modelling approach for tourism flows detection,2019,conference-paper,,"Maria Teresa Rossi, Martina De Sanctis, Ludovico Iovino, Adrian Rutle"
10.1016/J.DIB.2022.108526,Benchmark dataset of memes with text transcriptions for automatic detection of multi-modal misogynistic content,2022,journal-article,https://doi.org/10.1016/J.DIB.2022.108526,"Francesca Gasparini, Giulia Rizzi, Aurora Saibene, Elisabetta Fersini"
10.1007/978-3-031-08421-8_25,EEG-Based BCIs for Elderly Rehabilitation Enhancement Exploiting Artificial Data,2022,journal-article,https://doi.org/10.1007/978-3-031-08421-8_25,"Aurora Saibene, Francesca Gasparini, Jordi Solé-Casals"
10.1007/978-3-031-08421-8_19,Misogynous MEME Recognition: A Preliminary Study,2022,journal-article,https://doi.org/10.1007/978-3-031-08421-8_19,"Elisabetta Fersini, Giulia Rizzi, Aurora Saibene, Francesca Gasparini"
10.18653/v1/2022.semeval-1.74,SemEval-2022 Task 5: Multimedia Automatic Misogyny Identification,2022,conference-paper,https://doi.org/10.18653/v1/2022.semeval-1.74,"Elisabetta Fersini, Francesca Gasparini, Giulia Rizzi, Aurora Saibene, Berta Chulvi, Paolo Rosso, Alyssa Lees, Jeffrey Sorensen"
10.48550/ARXIV.2210.06290,The evolution of AI approaches for motor imagery EEG-based BCIs,2022,conference-paper,https://doi.org/10.48550/arxiv.2210.06290,
10.1016/J.ESWA.2021.114900,"Expert systems: Definitions, advantages and issues in medical field applications",2021,journal-article,https://doi.org/10.1016/J.ESWA.2021.114900,"Aurora Saibene, Michela Assale, Marta Giltri"
10.3389/FNINS.2019.01037,"Clustering the Brain With ""CluB"": A New Toolbox for Quantitative Meta-Analysis of Neuroimaging Data",2019,journal-article,https://doi.org/10.3389/FNINS.2019.01037,"Manuela Berlingeri, Francantonio Devoto, Francesca Gasparini, Aurora Saibene, Silvia E. Corchs, Lucia Clemente, Laura Danelli, Marcello Gallucci, Riccardo Borgoni, Nunzio Alberto Borghese, Eraldo Paulesu"
10.1007/978-3-030-34770-3_29,Cognitive and Physiological Response for Health Monitoring in an Ageing Population: A Multi-modal System,2019,journal-article,https://doi.org/10.1007/978-3-030-34770-3_29,"Aurora Saibene, Francesca Gasparini"
10.1002/mop.31660,Mechanical tuning of eighth‐mode substrate integrated waveguide (EMSIW) resonator antenna,2019,journal-article,https://doi.org/10.1002/mop.31660,"Farouk Grine, Mohamed T. Benhabiles, Hamza Amrani, Mohamed L. Riabi"
10.1002/mop.31660,Mechanical tuning of eighth-mode substrate integrated waveguide (EMSIW) resonator antenna,2019,journal-article,,"Farouk Grine, Mohamed T. Benhabiles, Hamza Amrani, Mohamed L. Riabi"
10.1016/j.compbiomed.2024.108346,"Characterization of cell cycle, inflammation, and oxidative stress signaling role in non-communicable diseases: Insights into genetic variants, microRNAs and pathways",2024,journal-article,https://doi.org/10.1016/j.compbiomed.2024.108346,"Salvatore D’Antona, Danilo Porro, Francesca Gallivanone, Gloria Bertoli"
10.1007/s10142-023-01228-4,From genetic correlations of Alzheimer’s disease to classification with artificial neural network models,2023,journal-article,https://doi.org/10.1007/s10142-023-01228-4,"Claudia Cava, Salvatore D’Antona, Francesca Maselli, Isabella Castiglioni, Danilo Porro"
10.1007/s00439-023-02525-5,Phenome-wide genetic-correlation analysis and genetically informed causal inference of amyotrophic lateral sclerosis,2023,journal-article,https://doi.org/10.1007/s00439-023-02525-5,"Salvatore D’Antona, Gita A. Pathak, Dora Koller, Danilo Porro, Claudia Cava, Renato Polimanti"
10.1016/j.csbj.2023.10.031,Computational analysis of five neurodegenerative diseases reveals shared and specific genetic loci,2023,journal-article,https://doi.org/10.1016/j.csbj.2023.10.031,"Francesca Maselli, Salvatore D’Antona, Mattia Utichi, Matteo Arnaudi, Isabella Castiglioni, Danilo Porro, Elena Papaleo, Paolo Gandellini, Claudia Cava"
10.1371/journal.pone.0277235,Consequences of exposure to pollutants on respiratory health: From genetic correlations to causal relationships,2022,journal-article,https://doi.org/10.1371/journal.pone.0277235,"Salvatore D’Antona, Isabella Castiglioni, Danilo Porro, Claudia Cava"
10.3390/app12105035,Transcriptional Profiling of Hippocampus Identifies Network Alterations in Alzheimer’s Disease,2022,journal-article,https://doi.org/10.3390/app12105035,"Veronica Quarato, Salvatore D’Antona, Petronilla Battista, Roberta Zupo, Rodolfo Sardone, Isabella Castiglioni, Danilo Porro, Marco Frasca, Claudia Cava"
10.3390/app12105035,Transcriptional Profiling of Hippocampus Identifies Network Alterations in Alzheimer’s Disease,2022,journal-article,,"Veronica Quarato, Salvatore D’Antona, Petronilla Battista, Roberta Zupo, Rodolfo Sardone, Isabella Castiglioni, Danilo Porro, Marco Frasca, Claudia Cava"
10.3389/fmed.2022.861960,Diagnostic Circulating miRNAs in Sporadic Amyotrophic Lateral Sclerosis,2022,journal-article,https://doi.org/10.3389/fmed.2022.861960,"A. Panio, C. Cava, S. D’Antona, G. Bertoli, D. Porro"
10.3389/fmed.2022.861960,Diagnostic Circulating miRNAs in Sporadic Amyotrophic Lateral Sclerosis,2022,journal-article,,"A. Panio, C. Cava, S. D’Antona, G. Bertoli, D. Porro"
10.3390/foods10123128,Amyotrophic Lateral Sclerosis: A Diet Review,2021,journal-article,https://doi.org/10.3390/foods10123128,"Salvatore D’Antona, Martina Caramenti, Danilo Porro, Isabella Castiglioni, Claudia Cava"
10.3390/foods10123128,Amyotrophic lateral sclerosis: A diet review,2021,journal-article,,"Salvatore D’Antona, Martina Caramenti, Danilo Porro, Isabella Castiglioni, Claudia Cava"
10.3390/jcm10153394,Minor Allele Frequencies and Molecular Pathways Differences for SNPs Associated with Amyotrophic Lateral Sclerosis in Subjects Participating in the UKBB and 1000 Genomes Project,2021,journal-article,https://doi.org/10.3390/jcm10153394,"Salvatore D’Antona, Gloria Bertoli, Isabella Castiglioni, Claudia Cava"
10.3390/jcm10153394,Minor allele frequencies and molecular pathways differences for SNPs associated with amyotrophic lateral sclerosis in subjects participating in the UKBB and 1000 genomes project,2021,journal-article,,"Salvatore D’Antona, Gloria Bertoli, Isabella Castiglioni, Claudia Cava"
10.1093/hmg/ddab114,Cross-ancestry genome-wide association studies identified heterogeneous loci associated with differences of allele frequency and regulome tagging between participants of European descent and other ancestry groups from the UK Biobank,2021,journal-article,https://doi.org/10.1093/hmg/ddab114,"Antonella De Lillo, Salvatore D'Antona, Gita A Pathak, Frank R Wendt, Flavio De Angelis, Maria Fuciarelli, Renato Polimanti"
10.1093/hmg/ddab114,Cross-ancestry genome-wide association studies identified heterogeneous loci associated with differences of allele frequency and regulome tagging between participants of european descent and other ancestry groups from the UK Biobank,2021,journal-article,,"Antonella De Lillo, Salvatore D'Antona, Gita A Pathak, Frank R Wendt, Flavio De Angelis, Maria Fuciarelli, Renato Polimanti"
10.1007/s11069-023-05822-4,Comparison of machine learning tools for damage classification: the case of L’Aquila 2009 earthquake,2023,journal-article,https://doi.org/10.1007/s11069-023-05822-4,"F. Di Michele, E. Stagnini, D. Pera, B. Rubino, R. Aloisio, A. Askan, P. Marcati"
10.1177/10812865221105812,Existence of solutions for a viscous hybrid quantum system for arbitrary large current density,2022,journal-article,https://doi.org/10.1177/10812865221105812,"Federica Di Michele, Bruno Rubino, Rosella Sampalmieri"
10.1007/s10950-022-10075-y,Fault shape effect on SH waves using finite element method,2022,journal-article,https://doi.org/10.1007/s10950-022-10075-y,"Federica Di Michele, Andriy Styahar, Donato Pera, Jon May, Roberto Aloisio, Bruno Rubino, Pierangelo Marcati"
10.1093/gji/ggac042,Spectral element numerical simulation of the 2009 L’Aquila earthquake on a detailed reconstructed domain,2022,journal-article,https://doi.org/10.1093/gji/ggac042,"F Di Michele, J May, D Pera, V Kastelic, M Carafa, C Smerzini, I Mazzieri, B Rubino, P F Antonietti, A Quarteroni, R Aloisio, P Marcati"
10.1109/iccsa54496.2021.00044,On the possible use of the not-honoring method to include a real thrust into 3D physical based simulations,2021,conference-paper,https://doi.org/10.1109/iccsa54496.2021.00044,"F. Di Michele, D. Pera, J. May, V. Kastelic, M. Carafa, A. Styahar, B. Rubino, R. Aloisio, P. Marcati"
10.1007/s10237-020-01360-1,A mechanical model of posterior vitreous detachment and generation of vitreoretinal tractions,2020,journal-article,,"Federica Di Michele, Amabile Tatone, Mario R. Romano, Rodolfo Repetto"
10.1016/j.amc.2019.01.046,"Modeling, simulation and optimization of a pressure retarded osmosis power station",2019,journal-article,,"F. Di Michele, E. Felaco, I. Gasser, A. Serbinovskiy, H. Struchtrup"
10.1177/1081286518814289,Stationary solutions for a new hybrid quantum model for semiconductors with discontinuous pressure functional and relaxation time,2019,journal-article,,"Federica Di Michele, Ming Mei, Bruno Rubino, Rosella Sampalmieri"
10.1128/spectrum.01056-24,High rate of macrolide resistance and closely genetically related Mycobacterium abscessus complex strains identified among both cystic fibrosis and non-cystic fibrosis patients within two countries,2024,journal-article,https://doi.org/10.1128/spectrum.01056-24,"Matúš Dohál, Věra Dvořáková, Michaela Hromádková, Martina Pinková, Jana Amlerová, Marek Schwarz, Andrea Spitaleri, Federico di Marco, Jarmila Hnilicová, Eduard Gondáš, Michael E. Rasmussen, Igor Porvazník, Ivan Solovič, Daniela M. Cirillo, Juraj Mokrý"
10.1128/jcm.00815-24,"Nanopore-based targeted sequencing test for direct tuberculosis identification, genotyping, and detection of drug resistance mutations: a side-by-side comparison of targeted next-generation sequencing technologies",2024,journal-article,https://doi.org/10.1128/jcm.00815-24,"Andrea Maurizio Cabibbe, Kiarash Moghaddasi, Virginia Batignani, Godstime Stephen Kojo Morgan, Federico Di Marco, Daniela Maria Cirillo"
10.1038/s42003-024-06929-5,Dual spatial host-bacterial gene expression in Mycobacterium abscessus respiratory infections,2024,journal-article,https://doi.org/10.1038/s42003-024-06929-5,"Federico Di Marco, Francesca Nicola, Francesca Giannese, Fabio Saliu, Giovanni Tonon, Stefano de Pretis, Daniela M. Cirillo, Nicola I. Lorè"
10.1128/aac.01354-24,"Erratum for Poonawala et al., “Transcriptomic responses to antibiotic exposure in Mycobacterium tuberculosis ”",2024,journal-article,https://doi.org/10.1128/aac.01354-24,"Husain Poonawala, Yu Zhang, Sravya Kuchibhotla, Anna G. Green, Daniela Maria Cirillo, Federico Di Marco, Andrea Spitaleri, Paolo Miotto, Maha R. Farhat"
10.1164/rccm.202312-2279LE,Single-Cell RNA Sequencing Shows that Circulating Monocytes Enriched in IFN Signaling Are Associated with Nontuberculous Mycobacteria Pulmonary Disease in Cystic Fibrosis,2024,journal-article,https://doi.org/10.1164/rccm.202312-2279LE,"Nicola I. Lorè, Andrea Gramegna, Stefano de Pretis, Federico Di Marco, Francesca Giannese, Fabio Saliu, Caterina Oneto, Martina Contarini, Lisa Cariani, Francesco Blasi, Daniela M. Cirillo"
10.1128/aac.01185-23,Transcriptomic responses to antibiotic exposure in Mycobacterium tuberculosis,2024,journal-article,https://doi.org/10.1128/aac.01185-23,"Husain Poonawala, Yu Zhang, Sravya Kuchibhotla, Anna G. Green, Daniela Maria Cirillo, Federico Di Marco, Andrea Spitlaeri, Paolo Miotto, Maha R. Farhat"
10.1038/s42003-024-06069-w,Genetic barriers more than environmental associations explain Serratia marcescens population structure,2024,journal-article,https://doi.org/10.1038/s42003-024-06069-w,"Lodovico Sterzi, Riccardo Nodari, Federico Di Marco, Maria Laura Ferrando, Francesca Saluzzo, Andrea Spitaleri, Hamed Allahverdi, Stella Papaleo, Simona Panelli, Sara Giordana Rimoldi, Gherard Batisti Biffignandi, Marta Corbella, Annalisa Cavallero, Paola Prati, Claudio Farina, Daniela Maria Cirillo, Gianvincenzo Zuccotti, Claudio Bandi, Francesco Comandatore"
10.3389/fmicb.2023.1104456,Advantages of long- and short-reads sequencing for the hybrid investigation of the <i>Mycobacterium tuberculosis</i> genome.,2023,journal-article,https://doi.org/10.3389/fmicb.2023.1104456,"Federico Di Marco, Andrea Spitaleri, Simone Battaglia, Virginia Batignani, Andrea Maurizio Cabibbe, Daniela Maria Cirillo"
10.2139/ssrn.4569732,Single Cells RNA Sequencing Reveals that Circulating Hyperinflammatory Monocytes are Associated with Mycobacterium abscessus Pulmonary Disease,2023,preprint,https://doi.org/10.2139/ssrn.4569732,"Nicola Ivan Lore, Andrea Gramegna, Stefano de Pretis, Federico Di Marco, Francesca Giannese, Fabio Saliu, Caterina Oneto, Martina Contarini, Lisa Cariani, Francesco Blasi, Daniela Cirillo"
10.3390/nu14235193,The Impact of a Mediterranean-like Diet with Controlled Protein Intake on the Onco-Nephrological Scenario: Time for a New Perspective,2022,journal-article,https://doi.org/10.3390/nu14235193,"Arianna Bettiga, Francesco Fiorio, Francesca Liguori, Federico Di Marco, Giulia Quattrini, Riccardo Vago, Domenico Giannese, Andrea Salonia, Francesco Montorsi, Francesco Trevisani"
10.3390/vaccines10050679,Renal Function Outcomes in Metastatic Non-Small-Cell Lung Carcinoma Patients Treated with Chemotherapy or Immune Checkpoint Inhibitors: An Unexpected Scenario,2022,journal-article,https://doi.org/10.3390/vaccines10050679,"Francesco Trevisani, Federico Di Marco, Matteo Floris, Antonello Pani, Roberto Minnei, Mario Scartozzi, Alessio Cirillo, Alain Gelibter, Andrea Botticelli, Erika Rijavec, Monica Cattaneo, Ornella Garrone, Michele Ghidini"
10.1016/j.jgar.2022.01.001,Detection of NDM-1/5 and OXA-48 co-producing extensively drug-resistant hypervirulent Klebsiella pneumoniae in Northern Italy,2022,journal-article,https://doi.org/10.1016/j.jgar.2022.01.001,"Giovanni Lorenzin, Floriana Gona, Simone Battaglia, Andrea Spitaleri, Francesca Saluzzo, Alberto Trovato, Federico di Marco, Paola Cichero, Anna Biancardi, Paola Nizzero, Barbara Castiglione, Paolo Scarpellini, Matteo Moro, Daniela Maria Cirillo"
10.3390/jcm10153322,Unexpected Outcomes of Renal Function after Radical Nephrectomy: Histology Relevance along with Clinical Aspects,2021,journal-article,https://doi.org/10.3390/jcm10153322,"Federico Di Marco, Antonello Pani, Matteo Floris, Alberto Martini, Giacomo Dell’Antonio, Umberto Capitanio, Arianna Bettiga, Alessandro Larcher, Alessandra Cinque, Roberto Bertini, Alberto Briganti, Andrea Salonia, Francesco Montorsi, Francesco Trevisani"
10.1002/ijc.33554,Renal function outcomes in patients with muscle-invasive bladder cancer treated with neoadjuvant pembrolizumab and radical cystectomy in the PURE-01 study.,2021,journal-article,https://doi.org/10.1002/ijc.33554,"Francesco Trevisani, Federico Di Marco, Daniele Raggi, Arianna Bettiga, Riccardo Vago, Alessandro Larcher, Alessandra Cinque, Andrea Salonia, Alberto Briganti, Umberto Capitanio, Andrea Necchi, Francesco Montorsi"
10.1002/ijc.33554,Renal function outcomes in patients with muscle-invasive bladder cancer treated with neoadjuvant pembrolizumab and radical cystectomy in the PURE-01 study,2021,journal-article,,"Francesco Trevisani, Federico Di Marco, Daniele Raggi, Arianna Bettiga, Riccardo Vago, Alessandro Larcher, Alessandra Cinque, Andrea Salonia, Alberto Briganti, Umberto Capitanio, Andrea Necchi, Francesco Montorsi"
10.3390/nu13041131,Preliminary Study on Pasta Samples Characterized in Antioxidant Compounds and Their Biological Activity on Kidney Cells,2021,journal-article,https://doi.org/10.3390/nu13041131,"Federico Di Marco, Francesco Trevisani, Pamela Vignolini, Silvia Urciuoli, Andrea Salonia, Francesco Montorsi, Annalisa Romani, Riccardo Vago, Arianna Bettiga"
10.3390/nu13041131,Preliminary study on pasta samples characterized in antioxidant compounds and their biological activity on kidney cells,2021,journal-article,,"Federico Di Marco, Francesco Trevisani, Pamela Vignolini, Silvia Urciuoli, Andrea Salonia, Francesco Montorsi, Annalisa Romani, Riccardo Vago, Arianna Bettiga"
10.1007/s40620-020-00905-y,Renal histology across the stages of chronic kidney disease.,2021,journal-article,https://doi.org/10.1007/s40620-020-00905-y,"Francesco Trevisani, Federico Di Marco, Umberto Capitanio, Giacomo Dell’Antonio, Alessandra Cinque, Alessandro Larcher, Roberta Lucianò, Arianna Bettiga, Riccardo Vago, Alberto Briganti, Andrea Salonia, Francesco Montorsi, Esteban Porrini"
