Doi,Title,Year,Type,Url,Authors
10.3233/FI-2020-1870,Unveiling the Hidden Dimension of Pedestrian Crowds: Introducing Personal Space and Crowding into Simulations,2020,journal-article,,"Stefania Bandini, Luca Crociani, Andrea Gorrini, Katsuhiro Nishinari, Giuseppe Vizzari"
10.1109/AIVR50618.2020.00042,Virtual Reality to Study Pedestrian Wayfinding: Motivations and an Experiment on Usability,2020,conference-paper,,Giuseppe Vizzari
10.1007/s11047-019-09766-2,A cellular automata based approach to track salient objects in videos,2019,journal-article,https://doi.org/10.1007/s11047-019-09766-2,"Luca Crociani, Giuseppe Vizzari, Antonio Carrieri, Stefania Bandini"
10.1007/s11047-019-09766-2,A cellular automata based approach to track salient objects in videos,2019,journal-article,,"Luca Crociani, Giuseppe Vizzari, Antonio Carrieri, Stefania Bandini"
10.1007/978-3-030-04672-9_22,Age-Friendly City and Walkability: Data from Observations Towards Simulations,2019,book,,"Andrea Gorrini, Luca Crociani, Giuseppe Vizzari, Stefania Bandini"
10.3233/WEB-190403,Stress estimation in pedestrian crowds: Experimental data and simulations results,2019,journal-article,,"Andrea Gorrini, Luca Crociani, Giuseppe Vizzari, Stefania Bandini"
10.1371/journal.pone.0309066,Implementing a multi-cycle datapath with Liquid Marbles,2024,journal-article,https://doi.org/10.1371/journal.pone.0309066,"Sandro Erba, Luca Cavenaghi, Claudio Zandron"
10.1142/S0129065724500217,Modular Spiking Neural Membrane Systems for Image Classification,2024,journal-article,https://doi.org/10.1142/S0129065724500217,"Iris Ermini, Claudio Zandron"
10.1016/j.knosys.2023.110266,On the computational efficiency of tissue P systems with evolutional symport/antiport rules,2023,journal-article,https://doi.org/10.1016/j.knosys.2023.110266,"Linqiang Pan, Bosheng Song, Claudio Zandron"
10.1007/s41965-020-00039-x,Bounding the space in P systems with active membranes,2020,journal-article,https://doi.org/10.1007/s41965-020-00039-x,Claudio Zandron
10.1007/s10489-021-02897-z,A fast algorithm for complex discord searches in time series: HOT SAX Time,2022,journal-article,https://doi.org/10.1007/s10489-021-02897-z,"Paolo Avogadro, Matteo Alessandro Dominoni"
10.1007/s10115-020-01453-4,Online anomaly search in time series: significant online discords,2020,journal-article,https://doi.org/10.1007/s10115-020-01453-4,"Paolo Avogadro, Luca Palonca, Matteo Alessandro Dominoni"
10.1007/978-3-030-66196-0_8,An Approximate High Quality Nearest Neighbor Distance Profile,2020,book-chapter,https://doi.org/10.1007/978-3-030-66196-0_8,"Paolo Avogadro, Matteo Alessandro Dominoni"
10.1007/s10817-022-09653-z,Linear Depth Deduction with Subformula Property for Intuitionistic Epistemic Logic,2023,journal-article,https://doi.org/10.1007/s10817-022-09653-z,Guido Fiorino
10.1016/j.ipl.2021.106167,A non-clausal tableau calculus for MinSat,2022,journal-article,https://doi.org/10.1016/j.ipl.2021.106167,Guido Fiorino
10.1007/s11219-024-09660-w,A family of experiments about how developers perceive delayed system response time,2024,journal-article,https://doi.org/10.1007/s11219-024-09660-w,"Oscar Cornejo, Daniela Briola, Daniela Micucci, Davide Ginelli, Leonardo Mariani, Adrián Santos Parrilla, Natalia Juristo"
10.1016/j.jss.2023.111629,Automatically generating test cases for safety-critical software via symbolic execution,2023,journal-article,https://doi.org/10.1016/j.jss.2023.111629,"Elson Kurian, Daniela Briola, Pietro Braione, Giovanni Denaro"
10.1007/978-3-031-48539-8_16,Fantastic MASs and Where to Find Them: First Results and Lesson Learned,2023,book-chapter,https://doi.org/10.1007/978-3-031-48539-8_16,"Daniela Briola, Angelo Ferrando, Viviana Mascardi"
10.3390/jsan10030047,Special Issue: Agents and Robots for Reliable Engineered Autonomy,2021,journal-article,https://doi.org/10.3390/jsan10030047,"Rafael C. Cardoso, Angelo Ferrando, Daniela Briola, Claudio Menghi, Tobias Ahlbrecht"
10.3390/jsan10020033,Agents and Robots for Reliable Engineered Autonomy:A Perspective from the Organisers of AREA 2020,2021,journal-article,https://doi.org/10.3390/jsan10020033,"Rafael C. Cardoso, Angelo Ferrando, Daniela Briola, Claudio Menghi, Tobias Ahlbrecht"
10.1017/S1471068419000462,"OntoScene, A Logic-Based Scene Interpreter: Implementation and Application in the Rock Art Domain",2020,journal-article,https://doi.org/10.1017/S1471068419000462,"DANIELA BRIOLA, VIVIANA MASCARDI, MASSIMILIANO GIOSEFFI"
10.1017/S1471068419000462,"OntoScene, A Logic-Based Scene Interpreter: Implementation and Application in the Rock Art Domain",2019,journal-article,,"DANIELA BRIOLA, VIVIANA MASCARDI, MASSIMILIANO GIOSEFFI"
10.1016/j.jss.2020.110523,In-the-field monitoring of functional calls: Is it feasible?,2020,journal-article,,"Oscar Cornejo, Daniela Briola, Daniela Micucci, Leonardo Mariani"
10.1109/ICST46399.2020.00033,CBR: Controlled Burst Recording,2020,conference-paper,,"Oscar Cornejo, Daniela Briola, Daniela Micucci, Leonardo Mariani"
10.1002/spe.2657,A platform for P2P agent-based collaborative applications,2019,journal-article,,"Daniela Briola, Daniela Micucci, Leonardo Mariani"
10.1109/ACCESS.2019.2925855,Field Monitoring with Delayed Saving,2019,journal-article,,"Oscar Cornejo, Davide Ginelli, Daniela Briola, Daniela Micucci, Leonardo Mariani"
10.3390/jimaging8090232,Angle-Retaining Chromaticity and Color Space: Invariants and Properties,2022,journal-article,https://doi.org/10.3390/jimaging8090232,Marco Buzzelli
10.1016/j.eswa.2021.116087,Structural similarity index (SSIM) revisited: A data-driven approach,2022,journal-article,https://doi.org/10.1016/j.eswa.2021.116087,"Illya Bakurov, Marco Buzzelli, Raimondo Schettini, Mauro Castelli, Leonardo Vanneschi"
10.1145/3475725.3483624,Analyzing and Recognizing Food in Constrained and Unconstrained Environments,2021,conference-paper,https://doi.org/10.1145/3475725.3483624,"Marco Buzzelli, Gianluigi Ciocca, Paolo Napoletano, Raimondo Schettini"
10.2352/issn.2694-118x.2021.lim-63,Image understanding for color constancy and vice versa,2021,journal-article,https://doi.org/10.2352/issn.2694-118x.2021.lim-63,"Simone Bianco, Marco Buzzelli"
10.1364/josaa.434860,On the evaluation of temporal and spatial stability of color constancy algorithms,2021,journal-article,https://doi.org/10.1364/josaa.434860,"Marco Buzzelli, Ilaria Erba"
10.1002/col.22675,Illumination estimation challenge: The experience of the first 2 years,2021,journal-article,https://doi.org/10.1002/col.22675,"Egor Ershov, Alex Savchik, Ilya Semenkov, Nikola Banić, Karlo Koščević, Marko Subašić, Alexander Belokopytov, Arseniy Terekhin, Daria Senshina, Artem Nikonorov, Zhihao Li, Yanlin Qian, Marco Buzzelli, Riccardo Riva, Simone Bianco, Raimondo Schettini, Jonathan T. Barron, Sven Lončarić, Dmitry Nikolaev"
10.1117/12.2587589,Consensus-driven illuminant estimation with GANs,2021,conference-paper,https://doi.org/10.1117/12.2587589,"Marco Buzzelli, Riccardo Riva, Simone Bianco, Raimondo Schettini"
10.3390/s21020596,"Revisiting the CompCars Dataset for Hierarchical Car Classification: New Annotations, Experiments, and Results",2021,journal-article,https://doi.org/10.3390/s21020596,"Marco Buzzelli, Luca Segantin"
10.1007/978-3-030-68780-9_46,On the Impact of Rain over Semantic Segmentation of Street Scenes,2021,book-chapter,https://doi.org/10.1007/978-3-030-68780-9_46,"Simone Zini, Marco Buzzelli"
10.1364/josaa.398692,ARC: Angle-Retaining Chromaticity diagram for color constancy error analysis,2020,journal-article,https://doi.org/10.1364/josaa.398692,"Marco Buzzelli, Simone Bianco, Raimondo Schettini"
10.2352/issn.2694-118x.2020.lim-13,Parameters optimization of the Structural Similarity Index,2020,journal-article,https://doi.org/10.2352/issn.2694-118x.2020.lim-13,"Illya Bakurov, Marco Buzzelli, Mauro Castelli, Raimondo Schettini, Leonardo Vanneschi"
10.3390/app10155143,"Recent Advances in Saliency Estimation for Omnidirectional Images, Image Groups, and Video Sequences",2020,journal-article,https://doi.org/10.3390/app10155143,Marco Buzzelli
10.3390/app10010374,A vision-based system for monitoring elderly people at home,2020,journal-article,,"Marco Buzzelli, Alessio Albé, Gianluigi Ciocca"
10.1007/s11042-018-6568-2,A unifying representation for pixel-precise distance estimation,2019,journal-article,https://doi.org/10.1007/s11042-018-6568-2,"Simone Bianco, Marco Buzzelli, Raimondo Schettini"
10.1007/978-3-030-30645-8_30,Combining Saliency Estimation Methods,2019,conference-paper,https://doi.org/10.1007/978-3-030-30645-8_30,"Marco Buzzelli, Simone Bianco, Gianluigi Ciocca"
10.1007/978-3-030-30645-8_30,Combining saliency estimation methods,2019,book,,"Marco Buzzelli, Simone Bianco, Gianluigi Ciocca"
10.1140/epjc/s10052-023-11889-x,Towards a muon collider,2023,journal-article,http://dx.doi.org/10.1140/epjc/s10052-023-11889-x,"Carlotta Accettura, Dean Adams, Rohit Agarwal, Claudia Ahdida, Chiara Aimè, Nicola Amapane, David Amorim, Paolo Andreetto, Fabio Anulli, Robert Appleby, Artur Apresyan, Aram Apyan, Sergey Arsenyev, Pouya Asadi, Mohammed Attia Mahmoud, Aleksandr Azatov, John Back, Lorenzo Balconi, Laura Bandiera, Roger Barlow, Nazar Bartosik, Emanuela Barzi, Fabian Batsch, Matteo Bauce, J. Scott Berg, Andrea Bersani, Alessandro Bertarelli, Alessandro Bertolin, Kevin Black, Fulvio Boattini, Alex Bogacz, Maurizio Bonesini, Bernardo Bordini, Salvatore Bottaro, Luca Bottura, Alessandro Braghieri, Marco Breschi, Natalie Bruhwiler, Xavier Buffat, Laura Buonincontri, Philip N. Burrows, Graeme Burt, Dario Buttazzo, Barbara Caiffi, Marco Calviani, Simone Calzaferri, Daniele Calzolari, Rodolfo Capdevilla, Christian Carli, Fausto Casaburo, Massimo Casarsa, Luca Castelli, Maria Gabriella Catanesi, Lorenzo Cavallucci, Gianluca Cavoto, Francesco Giovanni Celiberto, Luigi Celona, Alessandro Cerri, Gianmario Cesarini, Cari Cesarotti, Grigorios Chachamis, Antoine Chance, Siyu Chen, Yang-Ting Chien, Mauro Chiesa, Anna Colaleo, Francesco Collamati, Gianmaria Collazuol, Marco Costa, Nathaniel Craig, Camilla Curatolo, David Curtin, Giacomo Da Molin, Magnus Dam, Heiko Damerau, Sridhara Dasu, Jorge de Blas, Stefania De Curtis, Ernesto De Matteis, Stefania De Rosa, Jean-Pierre Delahaye, Dmitri Denisov, Haluk Denizli, Christopher Densham, Radovan Dermisek, Luca Di Luzio, Elisa Di Meco, Biagio Di Micco, Keith Dienes, Eleonora Diociaiuti, Tommaso Dorigo, Alexey Dudarev, Robert Edgecock, Filippo Errico, Marco Fabbrichesi, Stefania Farinon, Anna Ferrari, Jose Antonio Ferreira Somoza, Frank Filthaut, Davide Fiorina, Elena Fol, Matthew Forslund, Roberto Franceschini, Rui Franqueira Ximenes, Emidio Gabrielli, Michele Gallinaro, Francesco Garosi, Luca Giambastiani, Alessio Gianelle, Simone Gilardoni, Dario Augusto Giove, Carlo Giraldin, Alfredo Glioti, Mario Greco, Admir Greljo, Ramona Groeber, Christophe Grojean, Alexej Grudiev, Jiayin Gu, Chengcheng Han, Tao Han, John Hauptman, Brian Henning, Keith Hermanek, Matthew Herndon, Tova Ray Holmes, Samuel Homiller, Guoyuan Huang, Sudip Jana, Sergo Jindariani, Paul Bogdan Jurj, Yonatan Kahn, Ivan Karpov, David Kelliher, Wolfgang Kilian, Antti Kolehmainen, Kyoungchul Kong, Patrick Koppenburg, Nils Kreher, Georgios Krintiras, Karol Krizka, Gordan Krnjaic, Benjamin T. Kuchma, Nilanjana Kumar, Anton Lechner, Lawrence Lee, Qiang Li, Roberto Li Voti, Ronald Lipton, Zhen Liu, Shivani Lomte, Kenneth Long, Jose Lorenzo Gomez, Roberto Losito, Ian Low, Qianshu Lu, Donatella Lucchesi, Lianliang Ma, Yang Ma, Shinji Machida, Fabio Maltoni, Marco Mandurrino, Bruno Mansoulie, Luca Mantani, Claude Marchand, Samuele Mariotto, Stewart Martin-Haugh, David Marzocca, Paola Mastrapasqua, Giorgio Mauro, Andrea Mazzolari, Navin McGinnis, Patrick Meade, Barbara Mele, Federico Meloni, Matthias Mentink, Claudia Merlassino, Elias Metral, Rebecca Miceli, Natalia Milas, Nikolai Mokhov, Alessandro Montella, Tim Mulder, Riccardo Musenich, Marco Nardecchia, Federico Nardi, Niko Neufeld, David Neuffer, Daniel Novelli, Yasar Onel, Domizia Orestano, Daniele Paesani, Simone Pagan Griso, Mark Palmer, Paolo Panci, Giuliano Panico, Rocco Paparella, Paride Paradisi, Antonio Passeri, Nadia Pastrone, Antonello Pellecchia, Fulvio Piccinini, Alfredo Portone, Karolos Potamianos, Marco Prioli, Lionel Quettier, Emilio Radicioni, Raffaella Radogna, Riccardo Rattazzi, Diego Redigolo, Laura Reina, Elodie Resseguie, Jürgen Reuter, Pier Luigi Ribani, Cristina Riccardi, Lorenzo Ricci, Stefania Ricciardi, Luciano Ristori, Tania Natalie Robens, Werner Rodejohann, Chris Rogers, Marco Romagnoni, Kevin Ronald, Lucio Rossi, Richard Ruiz, Farinaldo S. Queiroz, Filippo Sala, Jakub Salko, Paola Salvini, Ennio Salvioni, Jose Santiago, Ivano Sarra, Francisco Javier Saura Esteban, Jochen Schieck, Daniel Schulte, Michele Selvaggi, Carmine Senatore, Abdulkadir Senol, Daniele Sertore, Lorenzo Sestini, Varun Sharma, Vladimir Shiltsev, Jing Shu, Federica Maria Simone, Rosa Simoniello, Kyriacos Skoufaris, Massimo Sorbi, Stefano Sorti, Anna Stamerra, Steinar Stapnes, Giordon Holtsberg Stark, Marco Statera, Bernd Stechauner, Daniel Stolarski, Diktys Stratakis, Shufang Su, Wei Su, Olcyr Sumensari, Xiaohu Sun, Raman Sundrum, Maximilian J. Swiatlowski, Alexei Sytov, Tim M. P. Tait, Jingyu Tang, Jian Tang, Andrea Tesi, Pietro Testoni, Brooks Thomas, Emily Anne Thompson, Riccardo Torre, Ludovico Tortora, Luca Tortora, Sokratis Trifinopoulos, Ilaria Vai, Marco Valente, Riccardo Umberto Valente, Alessandro Valenti, Nicolò Valle, Ursula van Rienen, Rosamaria Venditti, Arjan Verweij, Piet Verwilligen, Ludovico Vittorio, Paolo Vitulo, Liantao Wang, Hannsjorg Weber, Mariusz Wozniak, Richard Wu, Yongcheng Wu, Andrea Wulzer, Keping Xie, Akira Yamamoto, Yifeng Yang, Katsuya Yonehara, Sangsik Yoon, Angela Zaza, Xiaoran Zhao, Alexander Zlobin, Davide Zuliani, Jose Zurita"
10.18429/JACoW-IPAC2019-MOPTS103,First results of beam commissioning on the ESS site for the ion source and low energy beam transport,2019,conference-paper,http://dx.doi.org/10.18429/JACoW-IPAC2019-MOPTS103,
10.1371/journal.pcbi.1012512,Gene signatures for cancer research: A 25-year retrospective and future avenues,2024,journal-article,https://doi.org/10.1371/journal.pcbi.1012512,"Wei Liu, Huaqin He, Davide Chicco"
10.7717/peerj-cs.2256,Ten quick tips for clinical electroencephalographic (EEG) data acquisition and signal processing,2024,journal-article,https://doi.org/10.7717/peerj-cs.2256,"Giulia Cisotto, Davide Chicco"
10.7717/peerj-cs.2295,Ten quick tips for electrocardiogram (ECG) signal processing,2024,journal-article,https://doi.org/10.7717/peerj-cs.2295,"Davide Chicco, Angeliki-Ilektra Karaiskou, Maarten De Vos"
10.1371/journal.pdig.0000459,Identifying prognostic factors for survival in intensive care unit patients with SIRS or sepsis by machine learning analysis on electronic health records,2024,journal-article,https://doi.org/10.1371/journal.pdig.0000459,"Maximiliano Mollura, Davide Chicco, Alessia Paglialonga, Riccardo Barbieri"
10.1007/s41666-023-00138-1,Clinical Feature Ranking Based on Ensemble Machine Learning Reveals Top Survival Factors for Glioblastoma Multiforme,2024,journal-article,https://doi.org/10.1007/s41666-023-00138-1,"Gabriel Cerono, Ombretta Melaiu, Davide Chicco"
10.1371/journal.pcbi.1011700,Ten quick tips for fuzzy logic modeling of biomedical systems,2023,journal-article,https://doi.org/10.1371/journal.pcbi.1011700,"Davide Chicco, Simone Spolaor, Marco S. Nobile"
10.1016/j.ejca.2023.113291,Computational intelligence analysis of high-risk neuroblastoma patient health records reveals time to maximum response as one of the most relevant factors for outcome prediction,2023,journal-article,https://doi.org/10.1016/j.ejca.2023.113291,"Davide Chicco, Riccardo Haupt, Alberto Garaventa, Paolo Uva, Roberto Luksch, Davide Cangelosi"
10.1016/j.jbi.2023.104426,"A statistical comparison between Matthews correlation coefficient (MCC), prevalence threshold, and Fowlkes–Mallows index",2023,journal-article,https://doi.org/10.1016/j.jbi.2023.104426,"Davide Chicco, Giuseppe Jurman"
10.1371/journal.pcbi.1011272,Ten quick tips for bioinformatics analyses using an Apache Spark distributed computing environment,2023,journal-article,https://doi.org/10.1371/journal.pcbi.1011272,"Davide Chicco, Umberto Ferraro Petrillo, Giuseppe Cattaneo"
10.1371/journal.pcbi.1011224,Ten quick tips for avoiding pitfalls in multi-omics data integration analyses,2023,journal-article,https://doi.org/10.1371/journal.pcbi.1011224,"Davide Chicco, Fabio Cumbo, Claudio Angione"
10.1186/s13040-023-00325-1,"Signature literature review reveals AHCY, DPYSL3, and NME1 as the most recurrent prognostic genes for neuroblastoma",2023,journal-article,https://doi.org/10.1186/s13040-023-00325-1,"Davide Chicco, Tiziana Sanavia, Giuseppe Jurman"
10.1186/s13040-023-00326-0,Ten simple rules for providing bioinformatics support within a hospital,2023,journal-article,https://doi.org/10.1186/s13040-023-00326-0,"Davide Chicco, Giuseppe Jurman"
10.1186/s13040-023-00322-4,The Matthews correlation coefficient (MCC) should replace the ROC AUC as the standard metric for assessing binary classification,2023,journal-article,https://doi.org/10.1186/s13040-023-00322-4,"Davide Chicco, Giuseppe Jurman"
10.1371/journal.pcbi.1010778,Ten quick tips for computational analysis of medical images,2023,journal-article,https://doi.org/10.1371/journal.pcbi.1010778,"Davide Chicco, Rakesh Shiradkar"
10.1371/journal.pcbi.1010718,Eleven quick tips for data cleaning and feature engineering,2022,journal-article,https://doi.org/10.1371/journal.pcbi.1010718,"Davide Chicco, Luca Oneto, Erica Tavazzi"
10.1186/s13040-022-00312-y,Towards a potential pan-cancer prognostic signature for gene expression based on probesets and ensemble machine learning,2022,journal-article,https://doi.org/10.1186/s13040-022-00312-y,"Davide Chicco, Abbas Alameer, Sara Rahmati, Giuseppe Jurman"
10.5334/dsj-2022-017,A Survey on Publicly Available Open Datasets Derived From Electronic Health Records (EHRs) of Patients with Neuroblastoma,2022,journal-article,https://doi.org/10.5334/dsj-2022-017,"Davide Chicco, Gabriel Cerono, Davide Cangelosi"
10.1371/journal.pcbi.1010395,Ten simple rules for organizing a special session at a scientific conference,2022,journal-article,https://doi.org/10.1371/journal.pcbi.1010395,"Davide Chicco, Philip E. Bourne"
10.1371/journal.pcbi.1010348,Nine quick tips for pathway enrichment analysis,2022,journal-article,https://doi.org/10.1371/journal.pcbi.1010348,"Davide Chicco, Giuseppe Agapito"
10.3389/frobt.2022.876814,An invitation to greater use of Matthews correlation coefficient in robotics and artificial intelligence,2022,journal-article,https://doi.org/10.3389/frobt.2022.876814,"Davide Chicco, Giuseppe Jurman"
10.1093/bioinformatics/btab852,geoCancerPrognosticDatasetsRetriever: a bioinformatics tool to easily identify cancer prognostic datasets on Gene Expression Omnibus (GEO),2022,journal-article,https://doi.org/10.1093/bioinformatics/btab852,"Abbas Alameer, Davide Chicco"
10.1007/978-1-0716-1839-4_12,geneExpressionFromGEO: An R Package to Facilitate Data Reading from Gene Expression Omnibus (GEO),2021,book-chapter,https://doi.org/10.1007/978-1-0716-1839-4_12,Davide Chicco
10.1007/978-1-0716-1839-4_12,geneExpressionFromGEO: An R Package to Facilitate Data Reading from Gene Expression Omnibus (GEO),2022,book-chapter,https://doi.org/10.1007/978-1-0716-1839-4_12,Davide Chicco
10.1109/access.2021.3133700,A machine learning analysis of health records of patients with chronic kidney disease at risk of cardiovascular disease,2021,journal-article,https://doi.org/10.1109/access.2021.3133700,"Davide Chicco, Christopher A. Lovejoy, Luca Oneto"
10.1109/ACCESS.2021.3133700,A Machine Learning Analysis of Health Records of Patients With Chronic Kidney Disease at Risk of Cardiovascular Disease,2021,journal-article,https://doi.org/10.1109/ACCESS.2021.3133700,"Davide Chicco, Christopher A. Lovejoy, Luca Oneto"
10.7717/peerj-cs.623,"The coefficient of determination R-squared is more informative than SMAPE, MAE, MAPE, MSE and RMSE in regression analysis evaluation",2021,journal-article,https://doi.org/10.7717/peerj-cs.623,"Davide Chicco, Matthijs J. Warrens, Giuseppe Jurman"
10.1109/ACCESS.2021.3084063,Arterial disease computational prediction and health record feature ranking among patients diagnosed with inflammatory bowel disease,2021,journal-article,https://doi.org/10.1109/ACCESS.2021.3084063,"Davide Chicco, Giuseppe Jurman"
10.1109/ACCESS.2021.3084063,Arterial Disease Computational Prediction and Health Record Feature Ranking Among Patients Diagnosed With Inflammatory Bowel Disease,2021,journal-article,https://doi.org/10.1109/ACCESS.2021.3084063,"Davide Chicco, Giuseppe Jurman"
10.1109/ACCESS.2021.3084050,The Matthews correlation coefficient (MCC) is more informative than Cohen’s Kappa and Brier score in binary classification assessment,2021,journal-article,https://doi.org/10.1109/ACCESS.2021.3084050,"Davide Chicco, Matthijs J. Warrens, Giuseppe Jurman"
10.1109/ACCESS.2021.3084050,The Matthews Correlation Coefficient (MCC) is More Informative Than Cohen’s Kappa and Brier Score in Binary Classification Assessment,2021,journal-article,https://doi.org/10.1109/ACCESS.2021.3084050,"Davide Chicco, Matthijs J. Warrens, Giuseppe Jurman"
10.1109/access.2021.3068614,The benefits of the Matthews correlation coefficient (MCC) over the diagnostic odds ratio (DOR) in binary classification assessment,2021,journal-article,https://doi.org/10.1109/access.2021.3068614,"Davide Chicco, Valery Starovoitov, Giuseppe Jurman"
10.1109/ACCESS.2021.3068614,The Benefits of the Matthews Correlation Coefficient (MCC) Over the Diagnostic Odds Ratio (DOR) in Binary Classification Assessment,2021,journal-article,https://doi.org/10.1109/ACCESS.2021.3068614,"Davide Chicco, Valery Starovoitov, Giuseppe Jurman"
10.1007/978-1-0716-0947-7_11,Brief survey on machine learning in epistasis,2021,book-chapter,https://doi.org/10.1007/978-1-0716-0947-7_11,"Davide Chicco, Trent Faultless"
10.1007/978-1-0716-0947-7_11,Brief Survey on Machine Learning in Epistasis,2021,book-chapter,https://doi.org/10.1007/978-1-0716-0947-7_11,"Davide Chicco, Trent Faultless"
10.1109/ACCESS.2021.3057196,An ensemble learning approach for enhanced classification of patients with hepatitis and cirrhosis,2021,journal-article,https://doi.org/10.1109/access.2021.3057196,"Davide Chicco, Giuseppe Jurman"
10.1109/ACCESS.2021.3057196,An Ensemble Learning Approach for Enhanced Classification of Patients With Hepatitis and Cirrhosis,2021,journal-article,https://doi.org/10.1109/ACCESS.2021.3057196,"Davide Chicco, Giuseppe Jurman"
10.1186/s13040-021-00244-z,"The Matthews correlation coefficient (MCC) is more reliable than balanced accuracy, bookmaker informedness, and markedness in two-class confusion matrix evaluation",2021,journal-article,https://doi.org/10.1186/s13040-021-00244-z,"Davide Chicco, Niklas Tötsch, Giuseppe Jurman"
10.1186/s13040-021-00235-0,Data analytics and clinical feature ranking of medical records of patients with sepsis,2021,journal-article,https://doi.org/10.1186/s13040-021-00235-0,"Davide Chicco, Luca Oneto"
10.1177/1460458220984205,"Computational intelligence identifies alkaline phosphatase (ALP), alpha-fetoprotein (AFP), and hemoglobin levels as most predictive survival factors for hepatocellular carcinoma",2021,journal-article,https://doi.org/10.1177/1460458220984205,"Davide Chicco, Luca Oneto"
https://doi.ieeecomputersociety.org/10.1109/TCBB.2020.3041527,An enhanced Random Forests approach to predict heart failure from small imbalanced gene expression data,2020,journal-article,https://doi.org/10.1109/tcbb.2020.3041527,"Davide Chicco, Luca Oneto"
10.1109/TCBB.2020.3041527,An Enhanced Random Forests Approach to Predict Heart Failure From Small Imbalanced Gene Expression Data,2021,journal-article,https://doi.org/10.1109/TCBB.2020.3041527,"Davide Chicco, Luca Oneto"
10.1002/ehf2.13073,Machine learning vs. conventional statistical models for predicting heart failure readmission and mortality,2020,journal-article,https://doi.org/10.1002/ehf2.13073,"Sheojung Shin, Peter C. Austin, Heather J. Ross, Husam Abdel‐Qadir, Cassandra Freitas, George Tomlinson, Davide Chicco, Meera Mahendiran, Patrick R. Lawler, Filio Billia, Anthony Gramolini, Slava Epelman, Bo Wang, Douglas S. Lee"
10.1002/ehf2.13073,Machine learning vs. conventional statistical models for predicting heart failure readmission and mortality,2021,journal-article,https://doi.org/10.1002/ehf2.13073,"Sheojung Shin, Peter C. Austin, Heather J. Ross, Husam Abdel‐Qadir, Cassandra Freitas, George Tomlinson, Davide Chicco, Meera Mahendiran, Patrick R. Lawler, Filio Billia, Anthony Gramolini, Slava Epelman, Bo Wang, Douglas S. Lee"
10.1038/s41598-020-73558-3,"Survival prediction of patients with sepsis from age, sex, and septic episode number alone",2020,journal-article,https://doi.org/10.1038/s41598-020-73558-3,"Davide Chicco, Giuseppe Jurman"
10.1007/978-1-0716-0826-5_3,Siamese neural networks: an overview,2020,book-chapter,https://doi.org/10.1007/978-1-0716-0826-5_3,Davide Chicco
10.1007/978-1-0716-0826-5_3,Siamese Neural Networks: An Overview,2021,book-chapter,https://doi.org/10.1007/978-1-0716-0826-5_3,Davide Chicco
10.3389/fgene.2020.00309,Editorial: Artificial intelligence bioinformatics: development and application of tools for omics and inter-omics studies,2020,journal-article,https://doi.org/10.3389/fgene.2020.00309,"Davide Chicco, Dominik Heider, Angelo Facchiano"
10.1186/s12911-020-1023-5,Machine learning can predict survival of patients with heart failure from serum creatinine and ejection fraction alone,2020,journal-article,https://doi.org/10.1186/s12911-020-1023-5,"Davide Chicco, Giuseppe Jurman"
