Doi,Title,Year,Type,Url,Authors,Topic,Subfield,Field,Domain,Cites,Cited_by,Keywords,Abstract
10.1007/978-3-031-08421-8_23,ArabCeleb: Speaker Recognition in Arabic,2022,book-chapter,https://doi.org/10.1007/978-3-031-08421-8_23,"0000-0002-7070-1545, 0000-0002-5925-2646, 0000-0003-0323-5078, 0000-0001-9112-0574, 0000-0002-5071-0161, 0000-0001-7432-4284, 0000-0001-7461-1451, 0009-0007-1588-969X",Speech Recognition Technology,Artificial Intelligence,Computer Science,Physical Sciences,18,1,"['Speaker Verification', 'Spoken Dialogue Systems', 'End-to-End Speech Recognition', 'Automatic Speech Recognition', 'Language Modeling']"
10.1109/TCI.2022.3203889,COCOA: Combining Color Constancy Algorithms for Images and Videos,2022,journal-article,,"0000-0002-7070-1545, 0000-0002-8505-1581, 0000-0003-1138-3345, 0000-0001-7461-1451",Color Constancy and Colorimetry,"Atomic and Molecular Physics, and Optics",Physics and Astronomy,Physical Sciences,44,5,"['Standard illuminant', 'Color Constancy', 'Contrast Enhancement', 'Colorimetry', 'Single Image Restoration', 'Image Processing']"
10.1109/TCI.2022.3203889,COCOA: Combining Color Constancy Algorithms for Images and Videos,2022,journal-article,https://doi.org/10.1109/TCI.2022.3203889,"0000-0002-7070-1545, 0000-0002-8505-1581, 0000-0003-1138-3345, 0000-0001-7461-1451",Color Constancy and Colorimetry,"Atomic and Molecular Physics, and Optics",Physics and Astronomy,Physical Sciences,44,5,"['Standard illuminant', 'Color Constancy', 'Contrast Enhancement', 'Colorimetry', 'Single Image Restoration', 'Image Processing']"
10.3390/s22103832,Designing an AI-Based Virtual Try-On Web Application,2022,journal-article,,"0000-0002-7070-1545, 0000-0003-2389-0301, 0000-0003-2878-2131",Face Recognition and Analysis Techniques,Computer Vision and Pattern Recognition,Computer Science,Physical Sciences,64,12,"['Eyewear', '3D Face Reconstruction', 'Visual Attention', 'Feature Learning', 'Top-Down Attention', 'Virtual image']"
10.3390/s22103832,Designing an AI-Based Virtual Try-On Web Application,2022,journal-article,https://doi.org/10.3390/s22103832,"0000-0002-7070-1545, 0000-0003-2389-0301, 0000-0003-2878-2131",Face Recognition and Analysis Techniques,Computer Vision and Pattern Recognition,Computer Science,Physical Sciences,64,12,"['Eyewear', '3D Face Reconstruction', 'Visual Attention', 'Feature Learning', 'Top-Down Attention', 'Virtual image']"
10.1109/CVPRW56347.2022.00122,Fast-n-Squeeze: towards real-time spectral reconstruction from RGB images,2022,conference-paper,,"0000-0002-7070-1545, 0000-0002-0009-8007, 0000-0002-7211-8724, 0000-0003-1138-3345, 0000-0002-6328-5926, 0000-0001-7461-1451",Multispectral and Hyperspectral Image Fusion,Media Technology,Engineering,Physical Sciences,15,4,"['RGB color model', 'Transformation matrix', 'Single Image Restoration', 'Color Transfer', 'Image Fusion', 'Image Denoising', 'Hyperspectral Imaging', 'Matrix (chemical analysis)']"
10.1109/ICCE-Berlin56473.2022.9937098,Image Captioning using Pretrained Language Models and Image Segmentation,2022,conference-paper,,"0000-0002-7070-1545, 0000-0001-8876-6323, 0000-0001-9112-0574",Visual Question Answering in Images and Videos,Computer Vision and Pattern Recognition,Computer Science,Physical Sciences,23,0,"['Closed captioning', 'Image Captioning', 'Feature Matching', 'Language Understanding', 'Representation Learning', 'Object Recognition', 'Segmentation-based object categorization']"
10.1109/ICCE-Berlin56473.2022.9937098,Image Captioning using Pretrained Language Models and Image Segmentation,2022,conference-paper,https://doi.org/10.1109/ICCE-Berlin56473.2022.9937098,"0000-0002-7070-1545, 0000-0001-8876-6323, 0000-0001-9112-0574",Visual Question Answering in Images and Videos,Computer Vision and Pattern Recognition,Computer Science,Physical Sciences,23,0,"['Closed captioning', 'Image Captioning', 'Feature Matching', 'Language Understanding', 'Representation Learning', 'Object Recognition', 'Segmentation-based object categorization']"
10.1109/ICCE-Berlin56473.2022.9937102,Incremental Two-Stage Logo Recognition with Knowledge Distillation,2022,conference-paper,,"0000-0002-7070-1545, 0000-0002-7211-8724, 0000-0003-1138-3345, 0000-0003-4304-9157",Image Feature Retrieval and Recognition Techniques,Computer Vision and Pattern Recognition,Computer Science,Physical Sciences,29,0,"['Logo (programming language)', 'Interest Point Detectors']"
10.1109/CVPRW56347.2022.00135,NTIRE 2022 Challenge on Night Photography Rendering,2022,conference-paper,,"0000-0002-7070-1545, 0000-0001-6797-6284, 0000-0003-3035-1365, 0000-0001-5305-8044, 0000-0002-3502-6759, 0000-0002-1478-0402, 0000-0002-9691-4231, 0000-0002-5931-4835, 0009-0006-2471-8473, 0009-0009-9203-4753, 0009-0004-3881-4752, 0000-0002-4857-5351, 0000-0002-1049-6391, 0000-0002-1841-2615, 0000-0003-2572-2934, 0000-0001-6345-6396, 0000-0002-3173-2533, 0000-0002-8979-7647, 0000-0002-7828-0415, 0000-0001-6295-3278, 0000-0001-8734-8605, 0000-0002-7554-8770, 0000-0002-2919-4158, 0000-0002-1134-6619, 0000-0002-2432-2026, 0000-0001-9177-0489, 0000-0002-8505-1581, 0000-0002-6086-9838, 0000-0003-1138-3345, 0000-0002-7211-8724, 0000-0001-7461-1451, 0000-0002-6682-2694, 0000-0003-1810-5540, 0000-0002-5272-7047, 0000-0001-7140-0130, 0009-0002-1356-3227, 0000-0002-4663-5322, 0000-0002-9550-779X, 0000-0003-1252-2001, 0009-0000-8794-5581, 0000-0002-2504-2608, 0009-0000-0488-5684, 0000-0002-2372-5552, 0000-0003-4544-3078, 0000-0003-3953-7692, 0000-0002-6419-273X, 0000-0001-9926-7490, 0000-0003-0491-7396, 0000-0002-6028-627X, 0000-0002-4427-2978, 0009-0006-4569-4693, 0009-0000-7904-9912, 0000-0001-6835-0136, 0000-0002-0248-2168, 0009-0000-5444-625X, 0000-0002-8067-9070, 0000-0003-1111-7522",Image Enhancement Techniques,Computer Vision and Pattern Recognition,Computer Science,Physical Sciences,52,22,"['RGB color model', 'Image Quality Assessment']"
10.1109/CVPRW56347.2022.00102,NTIRE 2022 Spectral Recovery Challenge and Data Set,2022,conference-paper,,"0000-0002-7070-1545, 0000-0003-0855-1387, 0000-0002-1478-0402, 0000-0003-2345-8586, 0000-0003-4439-3953, 0000-0002-8266-7102, 0000-0003-2518-5147, 0000-0003-4176-8035, 0000-0002-3651-8704, 0000-0002-4068-5361, 0000-0002-3620-2582, 0000-0002-3445-5711, 0000-0002-1841-2615, 0000-0002-8979-7647, 0000-0003-2572-2934, 0000-0002-7828-0415, 0000-0001-9181-6467, 0000-0002-2785-2145, 0000-0002-7491-0395, 0000-0002-3383-6504, 0000-0002-0204-1709, 0000-0002-3306-3142, 0009-0002-9557-2329, 0000-0001-9254-7270, 0000-0002-6762-7989, 0000-0002-5405-0252, 0000-0001-9197-6292, 0000-0002-5228-5410, 0000-0002-1635-7026, 0000-0002-0009-8007, 0000-0002-7211-8724, 0000-0003-1138-3345, 0000-0002-6328-5926, 0000-0001-7461-1451, 0000-0001-6094-6584, 0000-0001-5257-758X, 0000-0002-2145-4998, 0000-0002-6936-9338, 0000-0002-6178-4377, 0000-0001-6890-3650, 0009-0000-7904-9912, 0009-0006-4569-4693, 0000-0002-9550-779X, 0009-0000-8794-5581, 0000-0003-1252-2001, 0000-0002-4663-5322, 0000-0002-2504-2608, 0000-0002-7194-5218, 0000-0002-0750-0628, 0000-0001-8308-645X, 0009-0005-1904-3718, 0000-0002-3162-5148, 0000-0002-5217-2328",Image Denoising Techniques and Algorithms,Computer Vision and Pattern Recognition,Computer Science,Physical Sciences,52,51,"['RGB color model', 'JPEG', 'Data set', 'Hyperspectral Imaging', 'Multispectral', 'Super-Resolution', 'Hyperspectral']"
10.1016/j.softx.2021.100931,SfM Flow: A comprehensive toolset for the evaluation of 3D reconstruction pipelines,2021,journal-article,,"0000-0002-7070-1545, 0000-0003-2389-0301, 0000-0002-7211-8724, 0000-0003-2878-2131",Stereo Vision and Depth Estimation,Computer Vision and Pattern Recognition,Computer Science,Physical Sciences,9,9,"['3D Reconstruction', 'Scene Reconstruction', 'Ground truth', 'Visual hull', '3D Mapping', 'Optical Flow', 'Depth Estimation', 'Structure from motion']"
10.1109/ICCE-Berlin56473.2022.9937133,Truncated Edge-based Color Constancy,2022,conference-paper,,"0000-0002-7070-1545, 0000-0003-1138-3345",Color Constancy and Colorimetry,"Atomic and Molecular Physics, and Optics",Physics and Astronomy,Physical Sciences,20,1,"['Standard illuminant', 'Color Constancy', 'Contrast Enhancement', 'Illuminant Estimation', 'Change Detection', 'Colorimetry', 'Truncation (statistics)', 'Gaussian filter']"
10.1109/ICCE-Berlin56473.2022.9937133,Truncated Edge-based Color Constancy,2022,conference-paper,https://doi.org/10.1109/ICCE-Berlin56473.2022.9937133,"0000-0002-7070-1545, 0000-0003-1138-3345",Color Constancy and Colorimetry,"Atomic and Molecular Physics, and Optics",Physics and Astronomy,Physical Sciences,20,1,"['Standard illuminant', 'Color Constancy', 'Contrast Enhancement', 'Illuminant Estimation', 'Change Detection', 'Colorimetry', 'Truncation (statistics)', 'Gaussian filter']"
10.1109/THMS.2022.3170829,U-WeAr: User Recognition on Wearable Devices through Arm Gesture,2022,journal-article,,"0000-0002-7070-1545, 0000-0001-9112-0574, 0000-0001-7197-4441, 0000-0003-4901-2910",Gesture Recognition in Human-Computer Interaction,Human-Computer Interaction,Computer Science,Physical Sciences,39,12,"['Gesture Recognition', 'Inertial Sensors', 'Human Identification', 'Wearable Devices', 'Kinect Sensor', 'Identification (biology)']"
10.1109/THMS.2022.3170829,U-WeAr: User Recognition on Wearable Devices through Arm Gesture,2022,journal-article,https://doi.org/10.1109/THMS.2022.3170829,"0000-0002-7070-1545, 0000-0001-9112-0574, 0000-0001-7197-4441, 0000-0003-4901-2910",Gesture Recognition in Human-Computer Interaction,Human-Computer Interaction,Computer Science,Physical Sciences,39,12,"['Gesture Recognition', 'Inertial Sensors', 'Human Identification', 'Wearable Devices', 'Kinect Sensor', 'Identification (biology)']"
10.21203/rs.3.rs-1714666/v1,Video restoration based on deep learning: a comprehensive survey,2022,other,,"0000-0002-7070-1545, 0000-0002-6086-9838, 0000-0003-1138-3345, 0000-0002-7211-8724, 0000-0001-7461-1451",Single Image Super-Resolution Techniques,Computer Vision and Pattern Recognition,Computer Science,Physical Sciences,115,1,"['Deblurring', 'Benchmark (surveying)', 'Image Denoising', 'Depth Estimation', 'Video Enhancement']"
10.3390/s21227453,A Smart Mirror for Emotion Monitoring in Home Environments,2021,journal-article,,"0000-0002-7070-1545, 0000-0002-5925-2646, 0000-0003-2878-2131, 0000-0003-2389-0301, 0000-0001-9112-0574, 0000-0001-7461-1451",Emotion Recognition and Analysis in Multimodal Data,Experimental and Cognitive Psychology,Psychology,Social Sciences,59,14,"['Home automation', 'Smart Homes', 'Sensors', 'Smart environment']"
10.3390/s21227453,A Smart Mirror for Emotion Monitoring in Home Environments,2021,journal-article,https://doi.org/10.3390/s21227453,"0000-0002-7070-1545, 0000-0002-5925-2646, 0000-0003-2878-2131, 0000-0003-2389-0301, 0000-0001-9112-0574, 0000-0001-7461-1451",Emotion Recognition and Analysis in Multimodal Data,Experimental and Cognitive Psychology,Psychology,Social Sciences,59,14,"['Home automation', 'Smart Homes', 'Sensors', 'Smart environment']"
10.2352/issn.2169-2629.2021.29.300,An analysis of spectral similarity measures,2021,conference-paper,,"0000-0002-7070-1545, 0000-0002-0009-8007, 0000-0002-7211-8724, 0000-0002-6328-5926, 0000-0001-7461-1451, 0009-0002-8850-8599",Color Constancy and Colorimetry,"Atomic and Molecular Physics, and Optics",Physics and Astronomy,Physical Sciences,0,7,"['Similarity (geometry)', 'Rank correlation', 'Spectral Reflectance', 'Colorimetry', 'Color Constancy', 'Spectral Imaging', 'Rank (graph theory)']"
10.1007/s42484-021-00056-8,An introduction to quantum machine learning: from quantum logic to quantum deep learning,2021,journal-article,,"0000-0002-7070-1545, 0000-0003-3088-6132, 0000-0002-0944-9598",Quantum Computing and Simulation,Artificial Intelligence,Computer Science,Physical Sciences,114,37,"['Quantum Machine Learning', 'Quantum Computation', 'Quantum Simulation']"
10.1007/s42484-021-00056-8,An introduction to quantum machine learning: from quantum logic to quantum deep learning,2021,journal-article,https://doi.org/10.1007/s42484-021-00056-8,"0000-0002-7070-1545, 0000-0003-3088-6132, 0000-0002-0944-9598",Quantum Computing and Simulation,Artificial Intelligence,Computer Science,Physical Sciences,114,37,"['Quantum Machine Learning', 'Quantum Computation', 'Quantum Simulation']"
10.1016/j.patrec.2021.05.008,Disentangling Image distortions in deep feature space,2021,journal-article,,"0000-0002-7070-1545, 0000-0002-7211-8724, 0000-0002-6328-5926, 0000-0001-9112-0574",Image Quality Assessment in Multimedia Content,Computer Vision and Pattern Recognition,Computer Science,Physical Sciences,46,14,"['Distortion (music)', 'Feature (linguistics)', 'Similarity (geometry)', 'Stereoscopic Images', 'Image Processing', 'Deep Learning', 'Representation (politics)', 'Image Quality Assessment', 'Sparse Representations', 'Feature vector']"
10.1007/978-3-030-68790-8_36,"Faithful Fit, Markerless, 3D Eyeglasses Virtual Try-On",2021,conference-paper,,"0000-0002-7070-1545, 0000-0003-2389-0301, 0000-0003-2878-2131",Face Recognition and Analysis Techniques,Computer Vision and Pattern Recognition,Computer Science,Physical Sciences,18,7,"['Eyewear', 'Viewpoints', '3D Face Reconstruction', 'Virtual image']"
10.1007/978-3-030-68790-8_36,"Faithful Fit, Markerless, 3D Eyeglasses Virtual Try-On",2021,book-chapter,https://doi.org/10.1007/978-3-030-68790-8_36,"0000-0002-7070-1545, 0000-0003-2389-0301, 0000-0003-2878-2131",Face Recognition and Analysis Techniques,Computer Vision and Pattern Recognition,Computer Science,Physical Sciences,18,7,"['Eyewear', 'Viewpoints', '3D Face Reconstruction', 'Virtual image']"
10.1002/col.22675,Illumination estimation challenge: The experience of the first 2 years,2021,journal-article,,"0000-0002-7070-1545, 0000-0001-6797-6284, 0000-0003-3035-1365, 0000-0002-3900-8590, 0000-0002-4321-4557, 0000-0001-9698-7206, 0000-0002-1049-6391, 0000-0002-6287-4083, 0000-0003-4292-2049, 0000-0001-6295-3278, 0000-0003-3216-7852, 0000-0003-1138-3345, 0000-0002-2042-5669, 0000-0002-7211-8724, 0000-0001-7461-1451, 0000-0002-3761-7683, 0000-0002-0151-4850",Color Constancy and Colorimetry,"Atomic and Molecular Physics, and Optics",Physics and Astronomy,Physical Sciences,35,6,"['Illuminant Estimation', 'Color Constancy', 'Standard illuminant', 'Colorimetry', 'Contrast Enhancement', 'Depth Estimation', 'RGB color model']"
10.1007/978-3-030-68790-8_38,Who Is in the Crowd? Deep Face Analysis for Crowd Understanding,2021,conference-paper,,"0000-0002-7070-1545, 0000-0002-5925-2646, 0000-0001-7461-1451",Emotion Recognition and Analysis in Multimodal Data,Experimental and Cognitive Psychology,Psychology,Social Sciences,19,0,"['Facial Expression Analysis', 'Crowd psychology', 'Sentiment analysis']"
10.1007/978-3-030-68790-8_38,Who Is in the Crowd? Deep Face Analysis for Crowd Understanding,2021,book-chapter,https://doi.org/10.1007/978-3-030-68790-8_38,"0000-0002-7070-1545, 0000-0002-5925-2646, 0000-0001-7461-1451",Emotion Recognition and Analysis in Multimodal Data,Experimental and Cognitive Psychology,Psychology,Social Sciences,19,0,"['Facial Expression Analysis', 'Crowd psychology', 'Sentiment analysis']"
10.1109/RadarConf2043947.2020.9266516,AESA Adaptive Beamforming Using Deep Learning,2020,conference-paper,,"0000-0002-7070-1545, 0000-0002-7211-8724, 0000-0001-9112-0574, 0000-0003-4198-6606, 0009-0006-4582-8364, 0000-0003-3713-4283",Optimization Techniques for Antenna Arrays,Aerospace Engineering,Engineering,Physical Sciences,27,8,"['Antenna Arrays', 'Adaptive beamformer']"
10.1364/JOSAA.398692,ARC: Angle-Retaining Chromaticity diagram for color constancy error analysis,2020,journal-article,,"0000-0002-7070-1545, 0000-0003-1138-3345, 0000-0002-7211-8724, 0000-0001-7461-1451",Color Constancy and Colorimetry,"Atomic and Molecular Physics, and Optics",Physics and Astronomy,Physical Sciences,34,13,"['Chromaticity', 'Color Constancy', 'Colorimetry', 'Standard illuminant', 'Contrast Enhancement', 'Illuminant Estimation', 'Reflectance Reconstruction', 'Ground truth']"
10.1117/12.2587589,Consensus-driven illuminant estimation with GANs,2021,conference-paper,,"0000-0002-7070-1545, 0000-0003-1138-3345, 0000-0002-2042-5669, 0000-0002-7211-8724, 0000-0001-7461-1451",Stereo Vision and Depth Estimation,Computer Vision and Pattern Recognition,Computer Science,Physical Sciences,0,6,"['Standard illuminant', 'Illuminant Estimation', 'Gamut Mapping', 'Rendering', 'RGB color model']"
10.1109/ACCESS.2020.2984387,Deep Residual Autoencoder for Blind Universal JPEG Restoration,2020,journal-article,,"0000-0002-7070-1545, 0000-0002-8505-1581, 0000-0001-7461-1451",Single Image Super-Resolution Techniques,Computer Vision and Pattern Recognition,Computer Science,Physical Sciences,49,10,"['JPEG', 'Compression artifact', 'JPEG Compression', 'Image Denoising', 'Resampling Detection', 'Super-Resolution', 'Image Forgery Detection', 'Autoencoder', 'Robustness (evolution)', 'JPEG 2000']"
10.1109/ACCESS.2020.2984387,Deep Residual Autoencoder for Blind Universal JPEG Restoration,2020,journal-article,https://doi.org/10.1109/ACCESS.2020.2984387,"0000-0002-7070-1545, 0000-0002-8505-1581, 0000-0001-7461-1451",Single Image Super-Resolution Techniques,Computer Vision and Pattern Recognition,Computer Science,Physical Sciences,49,10,"['JPEG', 'Compression artifact', 'JPEG Compression', 'Image Denoising', 'Resampling Detection', 'Super-Resolution', 'Image Forgery Detection', 'Autoencoder', 'Robustness (evolution)', 'JPEG 2000']"
10.1016/j.dib.2019.105041,IVL-SYNTHSFM-v2: A synthetic dataset with exact ground truth for the evaluation of 3D reconstruction pipelines,2019,journal-article,,"0000-0002-7070-1545, 0000-0003-2389-0301, 0000-0002-7211-8724, 0000-0003-2878-2131",3D Geospatial Modelling Techniques,Geology,Earth and Planetary Sciences,Physical Sciences,4,8,"['Ground truth', 'Motion blur', 'Viewpoints', '3D Reconstruction', '3D Shape Measurement', 'Scene Reconstruction', 'Surface Profilometry', 'Structured Light', 'Structure from motion']"
10.1016/j.inffus.2019.12.007,Neural architecture search for image saliency fusion,2019,journal-article,,"0000-0002-7070-1545, 0000-0002-7211-8724, 0000-0003-1138-3345, 0000-0003-2878-2131, 0000-0001-7461-1451",Computational Modeling of Visual Saliency Detection,Computer Vision and Pattern Recognition,Computer Science,Physical Sciences,89,21,"['Benchmark (surveying)', 'Saliency Detection', 'Image Fusion', 'Backpropagation', 'Salient Object Detection', 'Image Segmentation', 'Neural Processing']"
10.1109/TIP.2020.2989584,Personalized Image Enhancement Using Neural Spline Color Transforms,2020,journal-article,,"0000-0002-7070-1545, 0000-0002-7211-8724, 0000-0001-9365-8167, 0009-0007-0604-7677, 0000-0001-7461-1451",Image Enhancement Techniques,Computer Vision and Pattern Recognition,Computer Science,Physical Sciences,34,27,"['Color Transfer', 'Image Processing', 'Single Image Restoration', 'Contrast Enhancement', 'Scene Reconstruction']"
10.1109/TPAMI.2019.2919824,Providing a Single Ground-Truth for Illuminant Estimation for the ColorChecker Dataset,2019,journal-article,,"0000-0002-7070-1545, 0000-0002-9631-296X, 0000-0003-1933-7706, 0000-0003-4926-3672, 0000-0002-5812-4052, 0000-0001-8046-9746, 0000-0003-3525-9197",Color Constancy and Colorimetry,"Atomic and Molecular Physics, and Optics",Physics and Astronomy,Physical Sciences,4,12,"['Standard illuminant', 'Ground truth', 'Colorimetry', 'Illuminant Estimation', 'Color Constancy', 'Single Image Restoration', 'Contrast Enhancement']"
10.1109/TPAMI.2019.2919824,Providing a Single Ground-Truth for Illuminant Estimation for the ColorChecker Dataset,2019,journal-article,https://doi.org/10.1109/TPAMI.2019.2919824,"0000-0002-7070-1545, 0000-0002-9631-296X, 0000-0003-1933-7706, 0000-0003-4926-3672, 0000-0002-5812-4052, 0000-0001-8046-9746, 0000-0003-3525-9197",Color Constancy and Colorimetry,"Atomic and Molecular Physics, and Optics",Physics and Astronomy,Physical Sciences,4,12,"['Standard illuminant', 'Ground truth', 'Colorimetry', 'Illuminant Estimation', 'Color Constancy', 'Single Image Restoration', 'Contrast Enhancement']"
10.1109/ISCE.2019.8900979,A Web Application for Glasses Virtual Try-on in 3D Space,2019,conference-paper,,"0000-0002-7070-1545, 0000-0003-2389-0301, 0000-0002-7211-8724, 0000-0003-2878-2131",Face Recognition and Analysis Techniques,Computer Vision and Pattern Recognition,Computer Science,Physical Sciences,11,5,"['Viewpoints', '3D Face Reconstruction', 'Visual Servoing']"
10.1109/ACCESS.2019.2923856,Biometric Recognition Using Multimodal Physiological Signals,2019,journal-article,,"0000-0002-7070-1545, 0000-0001-9112-0574",Brain-Computer Interfaces in Neuroscience and Medicine,Cognitive Neuroscience,Neuroscience,Life Sciences,39,34,"['Hyperparameter', 'Signal Processing', 'Physiological Monitoring', 'Pulse Oximetry', 'Brain-Computer Interfaces', 'Arrhythmia Detection']"
10.1109/ACCESS.2019.2923856,Biometric Recognition Using Multimodal Physiological Signals,2019,journal-article,https://doi.org/10.1109/ACCESS.2019.2923856,"0000-0002-7070-1545, 0000-0001-9112-0574",Brain-Computer Interfaces in Neuroscience and Medicine,Cognitive Neuroscience,Neuroscience,Life Sciences,39,34,"['Hyperparameter', 'Signal Processing', 'Physiological Monitoring', 'Pulse Oximetry', 'Brain-Computer Interfaces', 'Arrhythmia Detection']"
10.1007/978-3-030-30645-8_30,Combining Saliency Estimation Methods,2019,conference-paper,,"0000-0002-7070-1545, 0000-0003-1138-3345, 0000-0003-2878-2131",Computational Modeling of Visual Saliency Detection,Computer Vision and Pattern Recognition,Computer Science,Physical Sciences,37,2,"['Saliency Detection', 'Image Segmentation', 'Image Quality Assessment', 'Salient Object Detection', 'Stereoscopic Images']"
10.1007/978-3-030-30645-8_30,Combining Saliency Estimation Methods,2019,book-chapter,https://doi.org/10.1007/978-3-030-30645-8_30,"0000-0002-7070-1545, 0000-0003-1138-3345, 0000-0003-2878-2131",Computational Modeling of Visual Saliency Detection,Computer Vision and Pattern Recognition,Computer Science,Physical Sciences,37,2,"['Saliency Detection', 'Image Segmentation', 'Image Quality Assessment', 'Salient Object Detection', 'Stereoscopic Images']"
10.1109/CVPRW.2019.00245,Content-Preserving Tone Adjustment for Image Enhancement,2019,conference-paper,,"0000-0002-7070-1545, 0000-0002-7211-8724, 0000-0001-9365-8167, 0009-0007-0604-7677, 0000-0001-7461-1451",Image Enhancement Techniques,Computer Vision and Pattern Recognition,Computer Science,Physical Sciences,18,10,"['Tone mapping', 'Contrast Enhancement', 'Color Transfer', 'Single Image Restoration', 'Image Denoising', 'Image Processing', 'Tone (literature)']"
10.1145/3329189.3329219,Getting the most of few data for neonatal pain assessment,2019,conference-paper,,"0000-0002-7070-1545, 0000-0002-6328-5926, 0000-0001-7664-6930, 0000-0002-7211-8724",Pediatric Pain Assessment and Management,"Pediatrics, Perinatology and Child Health",Medicine,Health Sciences,16,0,"['Discriminator', 'Pain Assessment Tools', 'Pain Measurement', 'Pain Management', 'Neonatal Pain', 'Generative adversarial network', 'Pediatric Pain', 'Training set']"
10.1109/CVPRW.2019.00244,High-Resolution Single Image Dehazing Using Encoder-Decoder Architecture,2019,conference-paper,,"0000-0002-7070-1545, 0000-0002-7211-8724, 0000-0002-6328-5926, 0009-0007-0604-7677, 0000-0001-7461-1451",Image Enhancement Techniques,Computer Vision and Pattern Recognition,Computer Science,Physical Sciences,42,29,"['Dehazing', 'Single Image Restoration', 'Super-Resolution']"
10.1007/978-3-030-30645-8_16,Image Memorability Using Diverse Visual Features and Soft Attention,2019,conference-paper,,"0000-0002-7070-1545, 0000-0001-5272-6477, 0000-0002-6328-5926, 0000-0001-9112-0574, 0000-0002-7211-8724, 0000-0001-7461-1451, 0000-0003-4037-7235, 0000-0001-6269-1351",Computational Modeling of Visual Saliency Detection,Computer Vision and Pattern Recognition,Computer Science,Physical Sciences,28,2,"['Benchmark (surveying)', 'Feature (linguistics)', 'Visual Attention', 'Single Image Restoration', 'Feature Matching', 'Image Segmentation', 'Bottom-Up Attention']"
10.1007/978-3-030-13940-7_16,Learning Parametric Functions for Color Image Enhancement,2019,conference-paper,,"0000-0002-7070-1545, 0000-0001-9365-8167, 0000-0001-7432-4284, 0000-0001-7461-1451",Image Enhancement Techniques,Computer Vision and Pattern Recognition,Computer Science,Physical Sciences,13,20,"['Color Transfer', 'Contrast Enhancement', 'Image Processing', 'Single Image Restoration', 'Low-Light Enhancement']"
10.1007/978-3-030-13940-7_16,Learning Parametric Functions for Color Image Enhancement,2019,book-chapter,https://doi.org/10.1007/978-3-030-13940-7_16,"0000-0002-7070-1545, 0000-0001-9365-8167, 0000-0001-7432-4284, 0000-0001-7461-1451",Image Enhancement Techniques,Computer Vision and Pattern Recognition,Computer Science,Physical Sciences,13,20,"['Color Transfer', 'Contrast Enhancement', 'Image Processing', 'Single Image Restoration', 'Low-Light Enhancement']"
10.1145/3329189.3329221,Multimodal Car Driver Stress Recognition,2019,conference-paper,,"0000-0002-7070-1545, 0000-0002-7211-8724, 0000-0001-9112-0574, 0000-0001-7461-1451",Effects of Sleep Deprivation and Fatigue on Performance,Experimental and Cognitive Psychology,Psychology,Social Sciences,22,21,"['Concatenation (mathematics)', 'Emotion Recognition', 'Multimodal Data', 'Stress Marker', 'Driver Fatigue']"
10.1016/j.eswa.2019.05.036,Multitask painting categorization by deep multibranch neural network,2019,journal-article,,"0000-0002-7070-1545, 0000-0001-8924-9889, 0000-0001-9112-0574, 0000-0001-7461-1451",Neuroaesthetics and Aesthetic Perception in Neuroscience,Cognitive Neuroscience,Neuroscience,Life Sciences,65,42,"['Discriminative model', 'Texture Classification', 'Deep neural networks']"
