Doi,Title,Year,Type,Url,Authors,Topic,Subfield,Field,Domain,Cites,Cited_by,Keywords,Abstract
10.3390/a15100376,"Listening to the City, Attentively: A Spatio-Temporal Attention-Boosted Autoencoder for the Short-Term Flow Prediction Problem",2022,journal-article,https://doi.org/10.3390/a15100376,"0000-0001-9803-3668, 0000-0001-5432-7584, 0000-0002-2480-966X",Traffic Flow Prediction and Forecasting,Building and Construction,Engineering,Physical Sciences,54,10,"['Autoencoder', 'Traffic Flow', 'Short-Term Forecasting', 'Transit Network Design', 'Traffic Assignment', 'Social Sensing']"
10.1016/j.compbiomed.2024.108028,An integrated computational pipeline for machine learning-driven diagnosis based on Raman spectra of saliva samples,2024,journal-article,https://doi.org/10.1016/j.compbiomed.2024.108028,"0000-0002-4062-0824, 0000-0001-8566-7223, 0000-0002-8337-0415, 0000-0002-5543-0505, 0000-0003-2996-5714, 0000-0003-2618-3661",Biomedical Applications of Spectroscopy Techniques,Biophysics,"Biochemistry, Genetics and Molecular Biology",Life Sciences,42,2,"['Raman Spectroscopy', 'Coherent Anti-Stokes Raman Scattering Microscopy', 'Transfer Learning', 'Automated Diagnosis', 'Infrared Spectroscopy']"
10.3390/math11204347,Safe Optimal Control of Dynamic Systems: Learning from Experts and Safely Exploring New Policies,2023,journal-article,https://doi.org/10.3390/math11204347,"0000-0002-4062-0824, 0000-0003-1431-576X, 0000-0003-4187-4209, 0000-0002-8987-100X, 0000-0003-1131-3830",Multiobjective Optimization in Evolutionary Algorithms,Computational Theory and Mathematics,Computer Science,Physical Sciences,21,0,"['Soft Systems Methodology', 'Decision-making', 'System Dynamics']"
10.3390/a16100479,Problem-Driven Scenario Generation for Stochastic Programming Problems: A Survey,2023,journal-article,https://doi.org/10.3390/a16100479,"0000-0002-4062-0824, 0000-0003-1491-9336",Robust Optimization for Risk Management and Finance,Management Science and Operations Research,Decision Sciences,Social Sciences,48,0,"['Stochastic Programming', 'Robust Decision Making']"
10.3390/healthcare11111604,Embedding the Patient-Citizen Perspective into an Operational Framework for the Development and the Introduction of New Technologies in Rehabilitation Care: The Smart&amp;Touch-ID Model,2023,journal-article,https://doi.org/10.3390/healthcare11111604,"0000-0002-4062-0824, 0000-0002-7879-4723, 0000-0002-2851-8376, 0000-0003-1489-321X, 0000-0003-1261-2234, 0000-0002-8395-0452, 0000-0003-1342-5908, 0000-0002-5551-4741, 0000-0003-0573-7178, 0009-0003-5599-9181, 0000-0002-7659-885X, 0000-0003-2411-999X, 0000-0003-1381-9069, 0000-0002-1373-5802, 0000-0003-4772-9109, 0000-0002-6145-5274",Telemedicine in Global Healthcare,"Public Health, Environmental and Occupational Health",Medicine,Health Sciences,26,2,"['Remote Treatment', 'Patient Engagement']"
10.1007/978-3-031-13448-7_15,Deep Attributed Graph Embeddings,2022,book-chapter,https://doi.org/10.1007/978-3-031-13448-7_15,"0000-0002-4062-0824, 0000-0002-8987-100X, 0009-0000-3537-1977",Graph Neural Network Models and Applications,Artificial Intelligence,Computer Science,Physical Sciences,19,2,"['Graph embedding', 'Knowledge Graph Embedding', 'Representation Learning', 'Network Embedding', 'Signal Processing on Graphs', 'Graph Neural Networks', 'Representation (politics)', 'Clustering coefficient', 'Topological graph theory']"
10.1016/j.ipm.2021.102537,LearningToAdapt with word embeddings: Domain adaptation of Named Entity Recognition systems,2021,journal-article,https://doi.org/10.1016/j.ipm.2021.102537,"0000-0002-4062-0824, 0000-0002-7998-2267, 0000-0002-6328-9089, 0000-0002-8987-100X, 0000-0002-1801-5118",Natural Language Processing,Artificial Intelligence,Computer Science,Physical Sciences,90,40,"['Named Entity Recognition', 'Domain adaptation', 'Language Modeling', 'Neural Machine Translation', 'Multi-label Learning', 'Topic Modeling']"
10.1007/978-3-030-80599-9_4,Word Embedding-Based Topic Similarity Measures,2021,book-chapter,https://doi.org/10.1007/978-3-030-80599-9_4,"0000-0002-4062-0824, 0000-0002-0358-1854, 0000-0002-8987-100X",Natural Language Processing,Artificial Intelligence,Computer Science,Physical Sciences,27,15,"['Similarity (geometry)', 'Benchmark (surveying)', 'Topic Modeling', 'Theme (computing)', 'Word embedding', 'Semantic Similarity']"
10.1007/978-3-030-64583-0_31,Optimal Scenario-Tree Selection for Multistage Stochastic Programming,2020,book-chapter,https://doi.org/10.1007/978-3-030-64583-0_31,"0000-0002-4062-0824, 0000-0002-8518-5352, 0000-0003-1431-576X, 0000-0003-1131-3830",Gaussian Processes in Machine Learning,Artificial Intelligence,Computer Science,Physical Sciences,19,2,"['Tree (set theory)', 'Portfolio Optimization', 'Robust Decision Making', 'Stochastic Programming', 'Robust Optimization', 'Multi-Objective Optimization']"
10.1007/978-3-030-64583-0_27,Relational Bayesian Model Averaging for Sentiment Analysis in Social Networks,2020,book-chapter,https://doi.org/10.1007/978-3-030-64583-0_27,"0000-0002-4062-0824, 0000-0001-5531-3854, 0000-0002-8987-100X",Data Mining Techniques and Applications,Information Systems,Computer Science,Physical Sciences,23,1,"['Sentiment analysis', 'Benchmark (surveying)', 'Statistical relational learning', 'Ensemble Learning', 'Probabilistic Learning', 'Structure Learning', 'Inference Algorithms']"
10.3390/s19235192,Efficient Kernel-Based Subsequence Search for Enabling Health Monitoring Services in IoT-Based Home Setting,2019,journal-article,https://doi.org/10.3390/s19235192,"0000-0002-4062-0824, 0000-0003-1431-576X, 0000-0002-8896-5047",Clustering of Time Series Data and Algorithms,Signal Processing,Computer Science,Physical Sciences,32,3,"['Kernel (algebra)', 'Benchmark (surveying)', 'Dynamic Time Warping', 'Pattern Discovery', 'Similarity Measures', 'Dimensionality Reduction']"
10.1016/j.cor.2019.02.003,Computers &amp; operations research,2019,journal-article,,"0000-0002-4062-0824, 0000-0002-8987-100X, 0000-0002-0785-1583, 0000-0001-5484-0994",Design and Control of Warehouse Operations,Industrial and Manufacturing Engineering,Engineering,Physical Sciences,0,0,"['Dynamic Scheduling', 'Scheduling', 'Hybrid Optimization', 'Multi-objective', 'Manufacturing']"
10.1016/j.ins.2019.09.039,Constrained Relational Topic Models,2019,journal-article,,"0000-0002-4062-0824, 0000-0002-0358-1854, 0000-0002-8987-100X",Natural Language Processing,Artificial Intelligence,Computer Science,Physical Sciences,70,15,"['Topic Modeling', 'Benchmark (surveying)', 'Pretrained Models', 'Language Modeling', 'Named Entity Recognition', 'Document Categorization', 'Subject-matter expert']"
10.1007/978-3-030-29563-9_13,Word Embeddings for Unsupervised Named Entity Linking,2019,book-chapter,https://doi.org/10.1007/978-3-030-29563-9_13,"0000-0002-4062-0824, 0000-0002-7998-2267, 0000-0002-3018-0140, 0000-0002-8987-100X",Natural Language Processing,Artificial Intelligence,Computer Science,Physical Sciences,44,3,"['Named Entity Recognition', 'Language Modeling', 'Semantic Similarity', 'Part-of-Speech Tagging', 'Word Representation']"
10.1145/3660794,Predicting Failures of Autoscaling Distributed Applications,2024,journal-article,https://doi.org/10.1145/3660794,"0000-0001-5193-7379, 0000-0002-7566-8051, 0000-0002-4871-3734, 0009-0002-7428-2429, 0000-0003-3033-3044, 0009-0002-9750-2762",Log Analysis and System Performance Diagnosis,Computer Networks and Communications,Computer Science,Physical Sciences,26,0,"['Performance indicator', 'Model-driven Performance Prediction', 'Performance Prediction', 'Fault Localization', 'Cloud-Native Architecture', 'Scalability', 'Data set']"
10.1145/3656301,Editorial: ICSE and the Incredible Contradictions of Software Engineering,2024,journal-article,https://doi.org/10.1145/3656301,0000-0001-5193-7379,Impact of Big Data Analytics on Business Performance,Management Information Systems,"Business, Management and Accounting",Social Sciences,0,0,['Data Science']
10.1007/s10664-023-10406-8,Semantic matching in GUI test reuse,2024,journal-article,https://doi.org/10.1007/s10664-023-10406-8,"0000-0001-5193-7379, 0000-0001-8512-5029, 0000-0002-4844-4351, 0000-0001-5885-9297",Automated Software Testing Techniques,Software,Computer Science,Physical Sciences,53,0,"['Semantic Similarity', 'Search-Based Testing', 'Language Modeling', 'Automated Testing', 'Part-of-Speech Tagging']"
10.1145/3639829,Introduction to the Special Issue “Applying Innovative Technologies to Digitised and Born-Digital Archives”,2023,journal-article,https://doi.org/10.1145/3639829,0000-0001-5193-7379,Archival Science and Digital Preservation,Conservation,Arts and Humanities,Social Sciences,0,1,"['Digital Preservation', 'Archival Activism', 'Archives']"
10.1109/TSE.2023.3327583,Prevent: An Unsupervised Approach to Predict Software Failures in Production,2023,journal-article,https://doi.org/10.1109/TSE.2023.3327583,"0000-0001-5193-7379, 0000-0002-7566-8051, 0009-0002-7428-2429, 0000-0002-4844-4351",Log Analysis and System Performance Diagnosis,Computer Networks and Communications,Computer Science,Physical Sciences,57,4,"['Software Defect Prediction', 'Model-driven Performance Prediction', 'Fault Localization', 'Unsupervised', 'Performance Prediction', 'Supervised learning']"
10.1145/3551349.3556961,Call Me Maybe: Using NLP to Automatically Generate Unit Test Cases Respecting Temporal Constraints,2022,conference-paper,https://doi.org/10.1145/3551349.3556961,"0000-0001-5193-7379, 0000-0002-9635-2400, 0000-0002-6711-3080, 0000-0001-9379-277X",Automated Software Testing Techniques,Software,Computer Science,Physical Sciences,32,6,"['Test Case Prioritization', 'Testing-Effort Dependent Models', 'Unit testing']"
10.1109/ICST53961.2022.00017,Testing Software in Production Environments with Data from the Field,2022,conference-paper,,"0000-0001-5193-7379, 0000-0002-4591-7096, 0000-0001-8512-5029, 0000-0002-4193-5609",Automated Software Testing Techniques,Software,Computer Science,Physical Sciences,44,4,"['Testbed', 'Software Reliability Modeling', 'Automated Testing', 'System under test']"
10.1145/3447240,A Survey of Field-based Testing Techniques,2021,journal-article,,"0000-0001-5193-7379, 0000-0001-8749-1356, 0000-0001-9307-6781, 0000-0002-1076-0076, 0000-0002-4591-7096, 0000-0003-1860-8666, 0000-0001-8512-5029, 0000-0001-6039-138X, 0000-0003-2449-1724, 0000-0002-3416-3129, 0000-0003-3088-0339",Automated Software Testing Techniques,Software,Computer Science,Physical Sciences,106,21,"['Software testing', 'Automated Testing', 'Test strategy', 'Software performance testing', 'System integration testing', 'System testing']"
10.1109/AST52587.2021.00016,An Evolutionary Approach to Adapt Tests Across Mobile Apps,2021,conference-paper,,"0000-0001-5193-7379, 0000-0001-8512-5029, 0000-0001-5885-9297, 0000-0002-8308-1832",Automated Software Testing Techniques,Software,Computer Science,Physical Sciences,49,11,"['Automated Testing', 'Search-Based Testing', 'Test Management Approach', 'Mobile apps', 'Android application']"
10.1109/ICSE-Companion52605.2021.00042,GAssert: A Fully Automated Tool to Improve Assertion Oracles,2021,conference-paper,,"0000-0001-5193-7379, 0000-0001-5885-9297, 0000-0002-1423-1083, 0000-0003-3088-0339",Automated Software Testing Techniques,Software,Computer Science,Physical Sciences,7,8,"['Assertion', 'Executable', 'Automated Testing', 'Fault Detection and Correction', 'Software Defect Prediction']"
10.1145/3468264.3473137,Health of smart ecosystems,2021,conference-paper,,"0000-0001-5193-7379, 0000-0002-4871-3734, 0000-0002-3995-8529, 0000-0002-4193-5609",Security Challenges in Smart Grid Systems,Control and Systems Engineering,Engineering,Physical Sciences,10,2,"['Component (thermodynamics)', 'Architecting Complex Systems', 'Flexibility in System Design', 'Software Development', 'Smart objects', 'Smart environment']"
10.1145/3468264.3473137,Health of smart ecosystems,2021,conference-paper,https://doi.org/10.1145/3468264.3473137,"0000-0001-5193-7379, 0000-0002-4871-3734, 0000-0002-3995-8529, 0000-0002-4193-5609",Security Challenges in Smart Grid Systems,Control and Systems Engineering,Engineering,Physical Sciences,10,2,"['Component (thermodynamics)', 'Architecting Complex Systems', 'Flexibility in System Design', 'Software Development', 'Smart objects', 'Smart environment']"
10.1145/3449726.3462722,Improving assertion oracles with evolutionary computation,2021,conference-paper,,"0000-0001-5193-7379, 0000-0001-5885-9297, 0000-0002-1423-1083, 0000-0003-3088-0339",Automated Software Testing Techniques,Software,Computer Science,Physical Sciences,5,2,"['Assertion', 'Automated Testing']"
10.1016/j.jss.2021.111041,MeMo: Automatically identifying metamorphic relations in Javadoc comments for test automation,2021,journal-article,,"0000-0001-5193-7379, 0000-0002-9635-2400, 0000-0002-6711-3080, 0000-0001-9379-277X, 0009-0008-9969-3981",Automated Software Testing Techniques,Software,Computer Science,Physical Sciences,68,28,"['Automated Testing', 'Software Reliability Modeling', 'Fault Detection and Correction', 'Software Defect Prediction', 'Software testing', 'Scope (computer science)']"
10.1016/j.jss.2021.111041,MeMo: Automatically identifying metamorphic relations in Javadoc comments for test automation,2021,journal-article,https://doi.org/10.1016/j.jss.2021.111041,"0000-0001-5193-7379, 0000-0002-9635-2400, 0000-0002-6711-3080, 0000-0001-9379-277X, 0009-0008-9969-3981",Automated Software Testing Techniques,Software,Computer Science,Physical Sciences,68,28,"['Automated Testing', 'Software Reliability Modeling', 'Fault Detection and Correction', 'Software Defect Prediction', 'Software testing', 'Scope (computer science)']"
10.1016/j.jss.2021.110933,On introducing automatic test case generation in practice: A success story and lessons learned,2021,journal-article,,"0000-0001-5193-7379, 0000-0001-7251-1510, 0000-0001-8512-5029",Automated Software Testing Techniques,Software,Computer Science,Physical Sciences,67,13,"['Test Management Approach', 'Automated Testing', 'Dynamic Test Generation', 'Test Case Prioritization', 'Testing-Effort Dependent Models', 'Manual testing', 'Regression testing', 'Test harness', 'Test plan']"
10.1109/TSE.2019.2898199,Reusing Solutions Modulo Theories,2019,journal-article,,"0000-0001-5193-7379, 0000-0002-9524-6024, 0000-0002-7566-8051",Automated Software Testing Techniques,Software,Computer Science,Physical Sciences,32,6,"['Satisfiability modulo theories', 'Satisfiability', 'Software Reliability Modeling', 'Symbolic trajectory evaluation', 'Boolean satisfiability problem']"
10.1145/3460319.3464827,Semantic matching of GUI events for test reuse: are we there yet?,2021,conference-paper,,"0000-0001-5193-7379, 0000-0001-9527-7042, 0000-0003-2372-6878, 0000-0001-5885-9297",Automated Software Testing Techniques,Software,Computer Science,Physical Sciences,63,23,"['Search-Based Testing', 'Semantic matching', 'Graphical user interface', 'Semantic search']"
10.1145/3460319.3464827,Semantic matching of GUI events for test reuse: are we there yet?,2021,conference-paper,https://doi.org/10.1145/3460319.3464827,"0000-0001-5193-7379, 0000-0001-9527-7042, 0000-0003-2372-6878, 0000-0001-5885-9297",Automated Software Testing Techniques,Software,Computer Science,Physical Sciences,63,23,"['Search-Based Testing', 'Semantic matching', 'Graphical user interface', 'Semantic search']"
10.1002/stvr.1774,Statically driven generation of concurrent tests for thread‐safe classes,2021,journal-article,,"0000-0001-5193-7379, 0000-0001-5885-9297",Automated Software Testing Techniques,Software,Computer Science,Physical Sciences,94,1,"['Search-Based Testing', 'Dynamic Test Generation', 'Fault Detection and Correction', 'Testing-Effort Dependent Models', 'Concurrent object-oriented programming']"
10.1145/3368089.3409758,Evolutionary improvement of assertion oracles,2020,conference-paper,,"0000-0001-5193-7379, 0000-0001-5885-9297, 0000-0002-1423-1083, 0000-0003-3088-0339",Automated Software Testing Techniques,Software,Computer Science,Physical Sciences,44,28,"['Assertion', 'Executable', 'Fault Detection and Correction', 'Software Defect Prediction', 'Automated Testing']"
10.1145/3387904.3389273,Measuring Software Testability Modulo Test Quality,2020,conference-paper,,"0000-0001-5193-7379, 0000-0001-5885-9297, 0000-0002-8687-052X",Empirical Studies in Software Engineering,Information Systems,Computer Science,Physical Sciences,56,22,"['Code coverage', 'Software Reliability Modeling', 'Code refactoring', 'Test suite', 'Testing-Effort Dependent Models', 'Test Management Approach', 'Regression testing', 'Requirements Traceability', 'Software metric']"
10.1145/3417564.3417569,Peer Review,2020,journal-article,,0000-0001-5193-7379,Management and Reproducibility of Scientific Workflows,Information Systems and Management,Decision Sciences,Social Sciences,1,3,"['Software Process Improvement', 'Software Development']"
10.1016/j.jss.2019.110464,Predicting failures in multi-tier distributed systems,2019,journal-article,,"0000-0001-5193-7379, 0000-0001-8512-5029, 0000-0003-2120-2894, 0000-0001-8369-6936",Log Analysis and System Performance Diagnosis,Computer Networks and Communications,Computer Science,Physical Sciences,66,29,"['Model-driven Performance Prediction', 'Cloud-Native Architecture', 'Distributed Systems', 'Performance Prediction', 'Intrusion Detection']"
10.1109/ICST.2019.00024,An RBM Anomaly Detector for the Cloud,2019,conference-paper,,"0000-0001-5193-7379, 0000-0003-4342-2695",Log Analysis and System Performance Diagnosis,Computer Networks and Communications,Computer Science,Physical Sciences,54,9,"['Cloud-Native Architecture', 'Outlier Detection', 'Anomaly Detection', 'Intrusion Detection', 'Botnet Detection', 'Anomaly (physics)']"
10.1109/ICST.2019.00034,Coverage-Driven Test Generation for Thread-Safe Classes via Parallel and Conflict Dependencies,2019,conference-paper,,"0000-0001-5193-7379, 0000-0001-5885-9297",Automated Software Testing Techniques,Software,Computer Science,Physical Sciences,72,4,"['Error Detection', 'Dynamic Test Generation', 'Search-Based Testing', 'Testing-Effort Dependent Models']"
10.1109/ICSE-NIER.2019.00026,Energy-Based Anomaly Detection A New Perspective for Predicting Software Failures,2019,conference-paper,,"0000-0001-5193-7379, 0000-0003-4342-2695",Statistical Mechanics of Complex Networks,Statistical and Nonlinear Physics,Physics and Astronomy,Physical Sciences,20,7,"['Anomaly Detection', 'Model-driven Performance Prediction', 'Performance Prediction', 'Botnet Detection', 'Intrusion Detection']"
10.1007/978-3-031-72845-7_20,Enforcing Temporal Consistency for Color Constancy in Video Sequences,2024,book-chapter,https://doi.org/10.1007/978-3-031-72845-7_20,"0000-0001-7461-1451, 0000-0003-1138-3345, 0000-0002-6086-9838, 0000-0002-7070-1545",Color Constancy and Colorimetry,"Atomic and Molecular Physics, and Optics",Physics and Astronomy,Physical Sciences,19,0,"['Color Constancy', 'Contrast Enhancement', 'Colorimetry', 'Color Harmony', 'Color Transfer']"
10.1007/978-3-031-72845-7_17,Painter Verification Using Color Palettes: An Exploratory Study,2024,book-chapter,https://doi.org/10.1007/978-3-031-72845-7_17,"0000-0001-7461-1451, 0000-0002-7070-1545, 0000-0003-2878-2131",Neuroaesthetics and Aesthetic Perception in Neuroscience,Cognitive Neuroscience,Neuroscience,Life Sciences,25,0,"['Colorimetry', 'Color Constancy', 'Shape Matching', 'Illuminant Estimation', 'Artistic Preference']"
10.1016/j.eswa.2023.121368,Semi-supervised cross-lingual speech emotion recognition,2023,journal-article,https://doi.org/10.1016/j.eswa.2023.121368,"0000-0001-7461-1451, 0000-0002-0009-8007, 0000-0002-7070-1545, 0000-0002-5925-2646, 0000-0001-9112-0574, 0000-0002-5071-0161, 0000-0001-7432-4284, 0009-0007-1588-969X",Emotion Recognition and Analysis in Multimodal Data,Experimental and Cognitive Psychology,Psychology,Social Sciences,29,7,"['Robustness (evolution)', 'Emotion Recognition', 'Speech Emotion', 'Audio-Visual Speech Recognition', 'End-to-End Speech Recognition', 'Speech Enhancement', 'Labeled data']"
10.1007/978-3-031-51023-6_7,A General Purpose Method for Image Collection Summarization and Exploration,2024,book-chapter,https://doi.org/10.1007/978-3-031-51023-6_7,"0000-0001-7461-1451, 0000-0001-9112-0574, 0000-0001-6269-1351",Image Feature Retrieval and Recognition Techniques,Computer Vision and Pattern Recognition,Computer Science,Physical Sciences,21,0,"['Image Retrieval', 'Feature Matching', 'Content-Based Image Retrieval', 'Feature Descriptors', 'Image Inpainting']"
10.1109/LSP.2024.3475969,A RNN for temporal consistency in low-light videos enhanced by single-frame methods,2024,journal-article,https://doi.org/10.1109/LSP.2024.3475969,"0000-0001-7461-1451, 0000-0002-6086-9838, 0000-0003-1138-3345, 0000-0002-7070-1545",Image Quality Assessment in Multimedia Content,Computer Vision and Pattern Recognition,Computer Science,Physical Sciences,0,0,"['Monocular Depth Estimation', 'Scene Reconstruction', 'Stereoscopic Images', 'Scalable Video Coding', 'Depth Image-Based Rendering']"
10.1109/ACCESS.2024.3396990,Synthetic Data Pretraining for Hyperspectral Image Super-Resolution,2024,journal-article,https://doi.org/10.1109/ACCESS.2024.3396990,"0000-0001-7461-1451, 0000-0001-7133-4137, 0000-0002-0009-8007, 0000-0003-1997-2910, 0000-0001-9112-0574, 0000-0002-3965-3522, 0000-0002-0901-0251",Multispectral and Hyperspectral Image Fusion,Media Technology,Engineering,Physical Sciences,34,0,"['Leverage (statistics)', 'RGB color model', 'Hyperspectral Imaging', 'Hyperspectral', 'Deep Learning']"
10.1016/j.cageo.2023.105433,A deep scalable neural architecture for soil properties estimation from spectral information,2023,journal-article,https://doi.org/10.1016/j.cageo.2023.105433,"0000-0001-7461-1451, 0000-0001-7432-4284, 0000-0002-6052-3140, 0000-0003-3997-0576, 0000-0001-9112-0574",Chemometrics in Analytical Chemistry and Food Technology,Analytical Chemistry,Chemistry,Physical Sciences,43,4,"['Terrain Analysis', 'Digital Soil Mapping', 'Soil Properties', 'Spectral Analysis', 'Deep Learning', 'Feature (linguistics)', 'Silt']"
10.3390/jimaging9100232,DALib: A Curated Repository of Libraries for Data Augmentation in Computer Vision,2023,journal-article,https://doi.org/10.3390/jimaging9100232,"0000-0001-7461-1451, 0009-0000-7250-3158, 0000-0003-2389-0301, 0000-0003-2878-2131",Deep Learning in Computer Vision and Image Recognition,Computer Vision and Pattern Recognition,Computer Science,Physical Sciences,50,1,"['Computer Vision', 'Meta-Learning', 'Representation Learning', 'Visual Recognition', 'Transfer Learning']"
10.3390/s23187893,Quasi Real-Time Apple Defect Segmentation Using Deep Learning,2023,journal-article,https://doi.org/10.3390/s23187893,"0000-0001-7461-1451, 0000-0002-0009-8007, 0000-0001-9112-0574",Chemometrics in Analytical Chemistry and Food Technology,Analytical Chemistry,Chemistry,Physical Sciences,35,2,"['Overfitting', 'Surface Defect Detection', 'Fabric Defect Detection', 'RGB color model', 'Deep Learning', 'Wafer Map Defect Classification', 'Frame rate']"
10.3390/s23083788,An Open-Source Platform for GIS Data Management and Analytics,2023,journal-article,https://doi.org/10.3390/s23083788,"0000-0001-7461-1451, 0000-0001-7432-4284, 0000-0003-3929-8409, 0000-0001-9112-0574",Precision Agriculture Technologies,Plant Science,Agricultural and Biological Sciences,Life Sciences,34,5,"['Precision agriculture', 'Smart Farming', 'Vegetation Monitoring', 'Crop Yield Prediction', 'Agricultural Robotics']"
10.1002/col.22822,Analysis of biases in automatic white balance datasets and methods,2022,journal-article,https://doi.org/10.1002/col.22822,"0000-0001-7461-1451, 0000-0003-1138-3345, 0000-0002-8505-1581, 0000-0002-7070-1545, 0000-0003-2878-2131",Color Constancy and Colorimetry,"Atomic and Molecular Physics, and Optics",Physics and Astronomy,Physical Sciences,52,14,"['Standard illuminant', 'Color balance', 'Contrast Enhancement']"
10.1109/TIP.2023.3244662,Full-Reference Image Quality Expression via Genetic Programming,2023,journal-article,https://doi.org/10.1109/TIP.2023.3244662,"0000-0001-7461-1451, 0000-0002-6458-942X, 0000-0003-1138-3345, 0000-0002-8793-1451, 0000-0003-4732-3328",Image Quality Assessment in Multimedia Content,Computer Vision and Pattern Recognition,Computer Science,Physical Sciences,45,7,"['Image Quality Assessment', 'Single Image Restoration', 'Structural Similarity Index', 'Perceptual Quality', 'Super-Resolution', 'Similarity (geometry)']"
10.1007/978-3-031-43148-7_5,Shallow Camera Pipeline for Night Photography Enhancement,2023,book-chapter,https://doi.org/10.1007/978-3-031-43148-7_5,"0000-0001-7461-1451, 0000-0002-8505-1581, 0000-0002-6086-9838, 0000-0003-1138-3345, 0000-0002-7070-1545",Image Enhancement Techniques,Computer Vision and Pattern Recognition,Computer Science,Physical Sciences,21,0,"['Computational photography', 'Interpretability', 'Low-Light Enhancement', 'Contrast Enhancement', 'Background Subtraction', 'Image Processing', 'Single Image Restoration']"
10.1007/978-3-031-08421-8_23,ArabCeleb: Speaker Recognition in Arabic,2022,book-chapter,https://doi.org/10.1007/978-3-031-08421-8_23,"0000-0001-7461-1451, 0000-0002-7070-1545, 0000-0002-5925-2646, 0000-0003-0323-5078, 0000-0001-9112-0574, 0000-0002-5071-0161, 0000-0001-7432-4284, 0009-0007-1588-969X",Speech Recognition Technology,Artificial Intelligence,Computer Science,Physical Sciences,18,1,"['Speaker Verification', 'Spoken Dialogue Systems', 'End-to-End Speech Recognition', 'Automatic Speech Recognition', 'Language Modeling']"
