Doi,Title,Year,Type,Url,Authors,Topic,Subfield,Field,Domain,Cites,Cited_by,Keywords,Abstract
10.1109/TSC.2022.3188440,A Path Relinking Method for the Joint Online Scheduling and Capacity Allocation of DL Training Workloads in GPU as a Service Systems,2022,journal-article,https://doi.org/10.1109/TSC.2022.3188440,"0000-0002-2480-966X, 0000-0002-6549-924X, 0000-0003-0062-6049, 0000-0002-1868-8224, 0000-0003-4224-927X, 0000-0002-3553-2571",Distributed Coordination in Online Robotics Research,Computer Networks and Communications,Computer Science,Physical Sciences,30,3,"['Resource Allocation', 'Deep Learning', 'Large-Scale Optimization', 'Scalability']"
10.3390/a15100376,"Listening to the City, Attentively: A Spatio-Temporal Attention-Boosted Autoencoder for the Short-Term Flow Prediction Problem",2022,journal-article,https://doi.org/10.3390/a15100376,"0000-0002-2480-966X, 0000-0001-5432-7584, 0000-0001-9803-3668",Traffic Flow Prediction and Forecasting,Building and Construction,Engineering,Physical Sciences,54,10,"['Autoencoder', 'Traffic Flow', 'Short-Term Forecasting', 'Transit Network Design', 'Traffic Assignment', 'Social Sensing']"
10.1109/TCC.2020.3015703,Architectural Design of Cloud Applications: A Performance-Aware Cost Minimization Approach,2020,journal-article,,"0000-0002-2480-966X, 0000-0002-7350-6593, 0000-0003-4224-927X, 0000-0003-3422-5171, 0000-0003-0062-6049, 0000-0002-1109-6306",Log Analysis and System Performance Diagnosis,Computer Networks and Communications,Computer Science,Physical Sciences,50,10,"['Cloud-Native Architecture', 'Cloud Computing', 'Scalability', 'Virtualization', 'Edge Computing', 'Minification', 'Cost reduction']"
10.1109/TCC.2020.3015703,Architectural Design of Cloud Applications: A Performance-Aware Cost Minimization Approach,2020,journal-article,https://doi.org/10.1109/TCC.2020.3015703,"0000-0002-2480-966X, 0000-0002-7350-6593, 0000-0003-4224-927X, 0000-0003-3422-5171, 0000-0003-0062-6049, 0000-0002-1109-6306",Log Analysis and System Performance Diagnosis,Computer Networks and Communications,Computer Science,Physical Sciences,50,10,"['Cloud-Native Architecture', 'Cloud Computing', 'Scalability', 'Virtualization', 'Edge Computing', 'Minification', 'Cost reduction']"
10.1109/CCCS.2019.8888151,Optimizing on-demand GPUs in the Cloud for Deep Learning Applications Training,2019,conference-paper,,"0000-0002-2480-966X, 0000-0002-1868-8224, 0000-0003-0062-6049, 0000-0003-4224-927X, 0000-0002-3553-2571, 0000-0002-5195-1418",Optimization Methods in Machine Learning,Artificial Intelligence,Computer Science,Physical Sciences,24,7,"['GPU Computing', 'Deep Learning', 'Parallel Computing', 'Large-Scale Optimization', 'High-Performance Computing', 'Cost reduction', 'Feature (linguistics)', 'Popularity']"
10.1007/s10707-019-00356-z,On the composition and recommendation of multi-feature paths: a comprehensive approach,2019,journal-article,,"0000-0002-2480-966X, 0000-0001-7830-7596, 0000-0003-1748-5430, 0000-0001-9803-3668",Trajectory Data Mining and Analysis,Signal Processing,Computer Science,Physical Sciences,29,1,"['Representation (politics)', 'BitTorrent tracker', 'Feature (linguistics)', 'GPS Trajectories', 'Trajectory Data Mining']"
10.1007/978-3-031-72845-7_17,Painter Verification Using Color Palettes: An Exploratory Study,2024,book-chapter,https://doi.org/10.1007/978-3-031-72845-7_17,"0000-0003-2878-2131, 0000-0002-7070-1545, 0000-0001-7461-1451",Neuroaesthetics and Aesthetic Perception in Neuroscience,Cognitive Neuroscience,Neuroscience,Life Sciences,25,0,"['Colorimetry', 'Color Constancy', 'Shape Matching', 'Illuminant Estimation', 'Artistic Preference']"
10.3390/jimaging9100232,DALib: A Curated Repository of Libraries for Data Augmentation in Computer Vision,2023,journal-article,https://doi.org/10.3390/jimaging9100232,"0000-0003-2878-2131, 0009-0000-7250-3158, 0000-0003-2389-0301, 0000-0001-7461-1451",Deep Learning in Computer Vision and Image Recognition,Computer Vision and Pattern Recognition,Computer Science,Physical Sciences,50,1,"['Computer Vision', 'Meta-Learning', 'Representation Learning', 'Visual Recognition', 'Transfer Learning']"
10.1016/j.isprsjprs.2023.03.002,ENRICH: Multi-purposE dataset for beNchmaRking In Computer vision and pHotogrammetry,2023,journal-article,https://doi.org/10.1016/j.isprsjprs.2023.03.002,"0000-0003-2878-2131, 0000-0003-2389-0301, 0000-0001-7180-2279, 0000-0002-3404-6395, 0000-0002-7070-1545, 0000-0001-6097-5342",3D Geospatial Modelling Techniques,Geology,Earth and Planetary Sciences,Physical Sciences,50,8,"['Benchmarking', 'Ground truth', 'Image Recognition', 'Representation (politics)', 'Monocular']"
10.1002/col.22822,Analysis of biases in automatic white balance datasets and methods,2022,journal-article,https://doi.org/10.1002/col.22822,"0000-0003-2878-2131, 0000-0003-1138-3345, 0000-0002-8505-1581, 0000-0002-7070-1545, 0000-0001-7461-1451",Color Constancy and Colorimetry,"Atomic and Molecular Physics, and Optics",Physics and Astronomy,Physical Sciences,52,14,"['Standard illuminant', 'Color balance', 'Contrast Enhancement']"
10.1007/978-3-031-43153-1_8,Evaluation of 3D Reconstruction Pipelines Under Varying Imaging Conditions,2023,book-chapter,https://doi.org/10.1007/978-3-031-43153-1_8,"0000-0003-2878-2131, 0000-0003-2389-0301, 0000-0002-7070-1545",Stereo Vision and Depth Estimation,Computer Vision and Pattern Recognition,Computer Science,Physical Sciences,21,0,"['Scene Reconstruction', 'Motion blur', 'Viewpoints', 'Ground truth', 'Image Recognition', 'Object Detection', 'Computer Vision', '3D reconstruction']"
10.3390/s22103832,Designing an AI-Based Virtual Try-On Web Application,2022,journal-article,https://doi.org/10.3390/s22103832,"0000-0003-2878-2131, 0000-0003-2389-0301, 0000-0002-7070-1545",Face Recognition and Analysis Techniques,Computer Vision and Pattern Recognition,Computer Science,Physical Sciences,64,12,"['Eyewear', '3D Face Reconstruction', 'Visual Attention', 'Feature Learning', 'Top-Down Attention', 'Virtual image']"
10.1016/j.eswa.2021.115852,"A grid anchor based cropping approach exploiting image aesthetics, geometric composition, and semantics",2021,journal-article,https://doi.org/10.1016/j.eswa.2021.115852,"0000-0003-2878-2131, 0000-0002-5925-2646, 0000-0001-9112-0574",Computational Modeling of Visual Saliency Detection,Computer Vision and Pattern Recognition,Computer Science,Physical Sciences,52,6,"['Benchmark (surveying)', 'Image Segmentation', 'Image Quality Assessment', 'Rank (graph theory)']"
10.3390/s21227453,A Smart Mirror for Emotion Monitoring in Home Environments,2021,journal-article,https://doi.org/10.3390/s21227453,"0000-0003-2878-2131, 0000-0002-7070-1545, 0000-0002-5925-2646, 0000-0003-2389-0301, 0000-0001-9112-0574, 0000-0001-7461-1451",Emotion Recognition and Analysis in Multimodal Data,Experimental and Cognitive Psychology,Psychology,Social Sciences,59,14,"['Home automation', 'Smart Homes', 'Sensors', 'Smart environment']"
10.1007/978-3-030-68821-9_53,Analysis of Traditional Italian Food Recipes: Experiments and Results,2021,book-chapter,https://doi.org/10.1007/978-3-030-68821-9_53,"0000-0003-2878-2131, 0000-0001-8453-0807, 0000-0002-3706-0993",Web Data Extraction and Crawling Techniques,Information Systems,Computer Science,Physical Sciences,21,1,"['Safeguarding', 'Recipe', 'Presentation (obstetrics)', 'Intangible cultural heritage', 'Web Data Extraction']"
10.1007/978-3-030-68790-8_36,"Faithful Fit, Markerless, 3D Eyeglasses Virtual Try-On",2021,book-chapter,https://doi.org/10.1007/978-3-030-68790-8_36,"0000-0003-2878-2131, 0000-0003-2389-0301, 0000-0002-7070-1545",Face Recognition and Analysis Techniques,Computer Vision and Pattern Recognition,Computer Science,Physical Sciences,18,7,"['Eyewear', 'Viewpoints', '3D Face Reconstruction', 'Virtual image']"
10.1007/978-3-030-68790-8_22,Iconic-Based Retrieval of Grocery Images via Siamese Neural Network,2021,book-chapter,https://doi.org/10.1007/978-3-030-68790-8_22,"0000-0003-2878-2131, 0000-0001-9112-0574, 0000-0003-3929-8409",Shape Matching and Object Recognition,Computer Vision and Pattern Recognition,Computer Science,Physical Sciences,28,2,"['Image Retrieval', 'Feature Matching', 'Object Recognition', 'Content-Based Image Retrieval', 'Interest Point Detectors']"
10.1007/978-3-030-68790-8_26,Multi-task Learning for Supervised and Unsupervised Classification of Grocery Images,2021,book-chapter,https://doi.org/10.1007/978-3-030-68790-8_26,"0000-0003-2878-2131, 0000-0001-9112-0574, 0000-0003-3929-8409",DNA Barcoding for Food Authentication and Fraud Detection,Molecular Biology,"Biochemistry, Genetics and Molecular Biology",Life Sciences,28,10,"['Extractor', 'Food Authentication', 'Machine Vision', 'Feature (linguistics)', 'Supervised learning', 'Modalities']"
10.1007/s13042-020-01153-z,Benchmarking algorithms for food localization and semantic segmentation,2020,journal-article,https://doi.org/10.1007/s13042-020-01153-z,"0000-0003-2878-2131, 0000-0003-0068-6551, 0000-0001-8924-9889, 0000-0001-7461-1451",Breath Analysis Technology,Biomedical Engineering,Engineering,Physical Sciences,77,31,"['Benchmark (surveying)', 'Food Authentication', 'Benchmarking', 'Segmentation-based object categorization']"
10.1016/j.dib.2019.105041,IVL-SYNTHSFM-v2: A synthetic dataset with exact ground truth for the evaluation of 3D reconstruction pipelines,2019,journal-article,https://doi.org/10.1016/j.dib.2019.105041,"0000-0003-2878-2131, 0000-0003-2389-0301, 0000-0002-7211-8724",3D Geospatial Modelling Techniques,Geology,Earth and Planetary Sciences,Physical Sciences,4,8,"['Ground truth', 'Motion blur', 'Viewpoints', '3D Reconstruction', '3D Shape Measurement', 'Scene Reconstruction', 'Surface Profilometry', 'Structured Light', 'Structure from motion']"
10.3390/app10010374,A Vision-Based System for Monitoring Elderly People at Home,2020,journal-article,https://doi.org/10.3390/app10010374,"0000-0003-2878-2131, 0000-0003-1138-3345, 0000-0002-9617-8465",Human Action Recognition and Pose Estimation,Computer Vision and Pattern Recognition,Computer Science,Physical Sciences,28,48,"['Visual Tracking', 'Action Recognition', 'Activity Recognition', 'Motion Detection', 'Multiple Object Tracking', 'Cardinality (data modeling)']"
10.1109/ACCESS.2020.2973704,State Recognition of Food Images Using Deep Features,2020,journal-article,https://doi.org/10.1109/ACCESS.2020.2973704,"0000-0003-2878-2131, 0000-0003-1008-0692, 0000-0001-9112-0574",Breath Analysis Technology,Biomedical Engineering,Engineering,Physical Sciences,71,33,"['Food Authentication', 'Content-Based Image Retrieval']"
10.1007/978-3-030-30645-8_29,Autocropping: A Closer Look at Benchmark Datasets,2019,book-chapter,https://doi.org/10.1007/978-3-030-30645-8_29,"0000-0003-2878-2131, 0000-0002-5925-2646, 0000-0001-9112-0574, 0000-0001-7461-1451",Computational Modeling of Visual Saliency Detection,Computer Vision and Pattern Recognition,Computer Science,Physical Sciences,22,2,"['Benchmark (surveying)', 'Ground truth', 'Image Segmentation', 'Feature Matching', 'Image Retrieval', 'Image Processing', 'Single Image Restoration']"
10.1007/978-3-030-30645-8_30,Combining Saliency Estimation Methods,2019,book-chapter,https://doi.org/10.1007/978-3-030-30645-8_30,"0000-0003-2878-2131, 0000-0003-1138-3345, 0000-0002-7070-1545",Computational Modeling of Visual Saliency Detection,Computer Vision and Pattern Recognition,Computer Science,Physical Sciences,37,2,"['Saliency Detection', 'Image Segmentation', 'Image Quality Assessment', 'Salient Object Detection', 'Stereoscopic Images']"
10.1007/978-3-030-13940-7_19,Evaluating CNN-Based Semantic Food Segmentation Across Illuminants,2019,book-chapter,https://doi.org/10.1007/978-3-030-13940-7_19,"0000-0003-2878-2131, 0000-0001-8924-9889, 0000-0001-7461-1451",Breath Analysis Technology,Biomedical Engineering,Engineering,Physical Sciences,32,15,['Food Authentication']
10.1007/978-3-030-13940-7_13,Evaluation of Automatic Image Color Theme Extraction Methods,2019,book-chapter,https://doi.org/10.1007/978-3-030-13940-7_13,"0000-0003-2878-2131, 0000-0001-9112-0574, 0000-0001-7461-1451",Image Feature Retrieval and Recognition Techniques,Computer Vision and Pattern Recognition,Computer Science,Physical Sciences,31,5,"['Theme (computing)', 'Image Segmentation', 'Feature Matching']"
10.1016/j.datak.2024.102341,An interactive approach to semantic enrichment with geospatial data,2024,journal-article,https://doi.org/10.1016/j.datak.2024.102341,"0000-0002-5047-7371, 0000-0002-2480-966X, 0000-0001-8074-7793, 0000-0002-4339-8202, 0000-0002-9920-8877, 0009-0001-4855-8260",Understanding Human Mobility Patterns,Transportation,Social Sciences,Social Sciences,26,1,"['Semantic Web', 'Participatory GIS', 'Web-based GIS', 'Geospatial Crowdsourcing', 'Geovisualization', 'USable']"
10.1007/978-3-030-88361-4_34,BEEO: Semantic Support for Event-Based Data Analytics,2021,journal-article,https://doi.org/10.1007/978-3-030-88361-4_34,"0000-0002-5047-7371, 0000-0002-2480-966X, 0000-0001-7830-7596, 0000-0002-1801-5118, 0000-0002-6958-8215",Semantic Web and Ontology Development,Artificial Intelligence,Computer Science,Physical Sciences,17,0,"['Complex Event Processing', 'Schema Matching', 'Semantic Web', 'Data Integration']"
10.1016/j.future.2020.05.019,A fully automated approach to a complete Semantic Table Interpretation,2020,journal-article,,"0000-0002-5047-7371, 0000-0003-4139-1928, 0000-0002-8046-7502, 0000-0002-6958-8215",Data Quality Assessment and Improvement,Management Science and Operations Research,Decision Sciences,Social Sciences,38,33,"['Table (database)', 'Semantic Web']"
10.1016/J.FUTURE.2020.05.019,A fully automated approach to a complete Semantic Table Interpretation,2020,journal-article,https://doi.org/10.1016/J.FUTURE.2020.05.019,"0000-0002-5047-7371, 0000-0003-4139-1928, 0000-0002-8046-7502, 0000-0002-6958-8215",Data Quality Assessment and Improvement,Management Science and Operations Research,Decision Sciences,Social Sciences,38,33,"['Table (database)', 'Semantic Web']"
10.1007/978-3-030-32327-1_4,MantisTable: A Tool for Creating Semantic Annotations on Tabular Data,2019,book,,"0000-0002-5047-7371, 0000-0001-7840-6228, 0000-0002-8046-7502",Data Quality Assessment and Improvement,Management Science and Operations Research,Decision Sciences,Social Sciences,6,5,"['Table (database)', 'Interface (matter)', 'Semantic interpretation', 'Semantic Web', 'Graphical user interface', 'Semantic annotation']"
10.1007/978-3-030-32327-1_4,MantisTable: A Tool for Creating Semantic Annotations on Tabular Data,2019,book-chapter,https://doi.org/10.1007/978-3-030-32327-1_4,"0000-0002-5047-7371, 0000-0001-7840-6228, 0000-0002-8046-7502",Data Quality Assessment and Improvement,Management Science and Operations Research,Decision Sciences,Social Sciences,6,5,"['Table (database)', 'Interface (matter)', 'Semantic interpretation', 'Semantic Web', 'Graphical user interface', 'Semantic annotation']"
10.1007/978-3-030-32327-1_4,MantisTable: A Tool for Creating Semantic Annotations on Tabular Data,2019,journal-article,https://doi.org/10.1007/978-3-030-32327-1_4,"0000-0002-5047-7371, 0000-0001-7840-6228, 0000-0002-8046-7502",Data Quality Assessment and Improvement,Management Science and Operations Research,Decision Sciences,Social Sciences,6,5,"['Table (database)', 'Interface (matter)', 'Semantic interpretation', 'Semantic Web', 'Graphical user interface', 'Semantic annotation']"
10.1007/978-3-030-30796-7_22,Semantically-Enabled Optimization of Digital Marketing Campaigns,2019,book,,"0000-0002-5047-7371, 0000-0001-7830-7596, 0000-0001-5702-5493, 0000-0001-7643-8373, 0000-0002-1801-5118, 0000-0002-0623-4989, 0000-0001-6397-3705",Impact of Big Data Analytics on Business Performance,Management Information Systems,"Business, Management and Accounting",Social Sciences,14,11,"['Marketing Analytics', 'Analytics', 'Search engine optimization', 'Influencer Marketing', 'Predictive Analytics', 'Complex event processing']"
10.1007/978-3-030-30796-7_22,Semantically-Enabled Optimization of Digital Marketing Campaigns,2019,journal-article,https://doi.org/10.1007/978-3-030-30796-7_22,"0000-0002-5047-7371, 0000-0001-7830-7596, 0000-0001-5702-5493, 0000-0001-7643-8373, 0000-0002-1801-5118, 0000-0002-0623-4989, 0000-0001-6397-3705",Impact of Big Data Analytics on Business Performance,Management Information Systems,"Business, Management and Accounting",Social Sciences,14,11,"['Marketing Analytics', 'Analytics', 'Search engine optimization', 'Influencer Marketing', 'Predictive Analytics', 'Complex event processing']"
10.1101/2024.09.17.613426,PangeBlocks: customized construction of pangenome graphs via maximal blocks,2024,preprint,https://doi.org/10.1101/2024.09.17.613426,"0000-0001-5584-3089, 0000-0003-3425-2823, 0000-0001-7289-4988, 0000-0002-6469-4887, 0000-0001-8786-2276",Model-Driven Engineering in Software Development,Software,Computer Science,Physical Sciences,0,0,"['Graph Transformation', 'Parameterized Complexity', 'Kernelization', 'Graph Theory', 'Approximation Algorithms']"
10.1093/bioinformatics/btae292,RecGraph: recombination-aware alignment of sequences to variation graphs,2024,journal-article,https://doi.org/10.1093/bioinformatics/btae292,"0000-0001-5584-3089, 0000-0003-3425-2823, 0000-0001-7289-4988, 0000-0002-6469-4887, 0000-0001-8786-2276, 0000-0003-1885-500X, 0009-0004-1710-5500, 0000-0002-8479-7592",RNA Sequencing Data Analysis,Molecular Biology,"Biochemistry, Genetics and Molecular Biology",Life Sciences,42,0,"['Variation (astronomy)', 'sequence alignment', 'sequence variation', 'Phylogenetic Analysis', 'Environmental DNA Sequencing']"
10.1093/bioinformatics/btae292,RecGraph: recombination-aware alignment of sequences to variation graphs,2024,journal-article,,"0000-0001-5584-3089, 0000-0003-3425-2823, 0000-0001-7289-4988, 0000-0002-6469-4887, 0000-0001-8786-2276, 0000-0003-1885-500X, 0009-0004-1710-5500, 0000-0002-8479-7592",RNA Sequencing Data Analysis,Molecular Biology,"Biochemistry, Genetics and Molecular Biology",Life Sciences,42,0,"['Variation (astronomy)', 'sequence alignment', 'sequence variation', 'Phylogenetic Analysis', 'Environmental DNA Sequencing']"
10.1186/s12859-024-05958-5,PangeBlocks: customized construction of pangenome graphs via maximal blocks,2024,journal-article,,"0000-0001-5584-3089, 0000-0003-3425-2823, 0000-0001-6849-7568, 0000-0002-6469-4887, 0000-0002-7403-7039",RNA Sequencing Data Analysis,Molecular Biology,"Biochemistry, Genetics and Molecular Biology",Life Sciences,24,0,"['Heuristics', 'sequence alignment']"
10.1101/2023.11.06.565751,Differential quantification of alternative splicing events on spliced pangenome graphs,2023,preprint,https://doi.org/10.1101/2023.11.06.565751,"0000-0001-5584-3089, 0000-0002-6469-4887, 0000-0003-2439-0608, 0009-0002-6989-9117, 0000-0001-7289-4988, 0000-0001-8786-2276",Regulation of RNA Processing and Function,Molecular Biology,"Biochemistry, Genetics and Molecular Biology",Life Sciences,37,0,['Alternative Splicing']
10.3390/a16070333,Three Metaheuristic Approaches for Tumor Phylogeny Inference: An Experimental Comparison,2023,journal-article,https://doi.org/10.3390/a16070333,"0000-0001-5584-3089, 0000-0002-6469-4887, 0000-0002-5943-8037, 0000-0001-5977-9467",Genomic Landscape of Cancer and Mutational Signatures,Cancer Research,"Biochemistry, Genetics and Molecular Biology",Life Sciences,61,0,"['Phylogenetic Analysis', 'phylogenetic tree', 'Tumor Evolution', 'Particle Swarm Optimization', 'Cancer Genomics', 'Tree (set theory)']"
10.3390/a16070333,Three Metaheuristic Approaches for Tumor Phylogeny Inference: An Experimental Comparison,2023,journal-article,,"0000-0001-5584-3089, 0000-0002-6469-4887, 0000-0002-5943-8037, 0000-0001-5977-9467",Genomic Landscape of Cancer and Mutational Signatures,Cancer Research,"Biochemistry, Genetics and Molecular Biology",Life Sciences,61,0,"['Phylogenetic Analysis', 'phylogenetic tree', 'Tumor Evolution', 'Particle Swarm Optimization', 'Cancer Genomics', 'Tree (set theory)']"
10.1089/cmb.2022.0424,Reads2Vec: Efficient Embedding of Raw High-Throughput Sequencing Reads Data,2023,journal-article,,"0000-0001-5584-3089, 0000-0002-1443-2192, 0000-0003-1563-8130, 0000-0002-6469-4887, 0000-0002-4329-0234",Coronavirus Disease 2019 Research,Infectious Diseases,Medicine,Health Sciences,37,9,"['sequence alignment', 'sequence variation', 'Transfer Learning', 'Alignment-free sequence analysis', 'Representation (politics)']"
10.1007/978-3-031-34953-9_5,Multiallelic Maximal Perfect Haplotype Blocks with Wildcards via PBWT,2023,book-chapter,https://doi.org/10.1007/978-3-031-34953-9_5,"0000-0001-5584-3089, 0000-0001-7289-4988, 0000-0002-8479-7592, 0000-0001-9730-7516, 0009-0003-5838-5329",Microarray Data Analysis and Gene Expression Profiling,Molecular Biology,"Biochemistry, Genetics and Molecular Biology",Life Sciences,15,1,['Marker-Assisted Selection']
10.1007/978-3-031-34953-9_5,Multiallelic Maximal Perfect Haplotype Blocks with Wildcards via PBWT,2023,conference-paper,,"0000-0001-5584-3089, 0000-0001-7289-4988, 0000-0002-8479-7592, 0000-0001-9730-7516, 0009-0003-5838-5329",Microarray Data Analysis and Gene Expression Profiling,Molecular Biology,"Biochemistry, Genetics and Molecular Biology",Life Sciences,15,1,['Marker-Assisted Selection']
10.1093/gigascience/giac119,Accurate and fast clade assignment via deep learning and frequency chaos game representation,2022,journal-article,https://doi.org/10.1093/gigascience/giac119,"0000-0001-5584-3089, 0000-0003-3425-2823, 0000-0003-2287-0229, 0000-0002-6469-4887, 0000-0001-7289-4988",RNA Sequencing Data Analysis,Molecular Biology,"Biochemistry, Genetics and Molecular Biology",Life Sciences,37,3,"['Leverage (statistics)', 'sequence variation', 'sequence alignment', 'Chaos Game Representation', 'Pandemic', 'Coronavirus']"
10.1093/gigascience/giac119,Accurate and fast clade assignment via deep learning and frequency chaos game representation,2022,journal-article,,"0000-0001-5584-3089, 0000-0003-3425-2823, 0000-0003-2287-0229, 0000-0002-6469-4887, 0000-0001-7289-4988",RNA Sequencing Data Analysis,Molecular Biology,"Biochemistry, Genetics and Molecular Biology",Life Sciences,37,3,"['Leverage (statistics)', 'sequence variation', 'sequence alignment', 'Chaos Game Representation', 'Pandemic', 'Coronavirus']"
10.1101/2022.10.27.513962,RecGraph: adding recombinations to sequence-to-graph alignments,2022,preprint,https://doi.org/10.1101/2022.10.27.513962,"0000-0001-5584-3089, 0000-0003-3425-2823, 0000-0001-7289-4988, 0000-0002-6469-4887, 0000-0001-8786-2276, 0009-0004-1710-5500, 0000-0002-8479-7592",RNA Sequencing Data Analysis,Molecular Biology,"Biochemistry, Genetics and Molecular Biology",Life Sciences,21,2,"['sequence alignment', 'sequence variation', 'Multiple sequence alignment', 'Sequence (biology)']"
10.53962/q5n4-a3jp,Scalable variant detection in pangenome models,2022,book-chapter,https://doi.org/10.53962/q5n4-a3jp,0000-0001-5584-3089,RNA Sequencing Data Analysis,Molecular Biology,"Biochemistry, Genetics and Molecular Biology",Life Sciences,1,0,"['Fragment (logic)', 'sequence variation']"
10.53962/skdt-f8aq,Computational Aspects of Models of Evolution,2022,book-chapter,https://doi.org/10.53962/skdt-f8aq,0000-0001-5584-3089,Applications of 3D City Models,Building and Construction,Engineering,Physical Sciences,0,0,['Building Information Modeling']
10.1007/s11047-022-09882-6,Computational graph pangenomics: a tutorial on data structures and their applications,2022,journal-article,,"0000-0001-5584-3089, 0000-0001-5661-0658, 0000-0001-6849-7568, 0000-0002-9121-6717, 0000-0002-8479-7592, 0000-0001-9730-7516, 0000-0001-5828-4139",RNA Sequencing Data Analysis,Molecular Biology,"Biochemistry, Genetics and Molecular Biology",Life Sciences,93,32,"['genome annotation', 'Functional Genomics', 'Phylogenetic Analysis', 'ENCODE', '1000 Genomes Project', 'Personal genomics']"
10.1007/978-3-031-17531-2_11,Clustering SARS-CoV-2 Variants from Raw High-Throughput Sequencing Reads Data,2022,book-chapter,https://doi.org/10.1007/978-3-031-17531-2_11,"0000-0001-5584-3089, 0000-0002-1443-2192, 0000-0001-8121-2168, 0000-0002-6469-4887, 0000-0002-4329-0234",Coronavirus Disease 2019 Research,Infectious Diseases,Medicine,Health Sciences,42,9,"['sequence alignment', 'Support Vector Machines', 'sequence variation', 'Representation (politics)']"
10.1007/978-3-031-17531-2_11,Clustering SARS-CoV-2 Variants from Raw High-Throughput Sequencing Reads Data,2022,conference-paper,,"0000-0001-5584-3089, 0000-0002-1443-2192, 0000-0001-8121-2168, 0000-0002-6469-4887, 0000-0002-4329-0234",Coronavirus Disease 2019 Research,Infectious Diseases,Medicine,Health Sciences,42,9,"['sequence alignment', 'Support Vector Machines', 'sequence variation', 'Representation (politics)']"
10.1093/bioinformatics/btaa779,Shark: fishing relevant reads in an RNA-Seq sample,2020,journal-article,https://doi.org/10.1093/bioinformatics/btaa779,"0000-0001-5584-3089, 0000-0001-8786-2276, 0000-0002-8479-7592, 0000-0003-3040-9539, 0000-0001-9730-7516, 0000-0001-6849-7568",RNA Sequencing Data Analysis,Molecular Biology,"Biochemistry, Genetics and Molecular Biology",Life Sciences,28,8,"['Sample (material)', 'sequence alignment', 'RNA-Seq']"
10.1093/bioinformatics/btaa779,Shark: fishing relevant reads in an RNA-Seq sample,2020,journal-article,,"0000-0001-5584-3089, 0000-0001-8786-2276, 0000-0002-8479-7592, 0000-0003-3040-9539, 0000-0001-9730-7516, 0000-0001-6849-7568",RNA Sequencing Data Analysis,Molecular Biology,"Biochemistry, Genetics and Molecular Biology",Life Sciences,28,8,"['Sample (material)', 'sequence alignment', 'RNA-Seq']"
